title,seendate,url,sourcecountry,language,domain
Analyst revamps Nvidia stock price target ahead of earnings,2024-05-01 00:45:00+00:00,https://biztoc.com/x/5f5ff65d57934402,,English,biztoc.com
Analyst revamps Nvidia stock price target ahead of earnings,2024-05-01 02:30:00+00:00,https://www.news-daily.com/arena/thestreet/analyst-revamps-nvidia-stock-price-target-ahead-of-earnings/article_53b8ea7c-c45b-551a-9220-0dd763bce572.html,United States,English,news-daily.com
1 Unique S & P 500 ETF That Could Be a Great Buy Now,2024-05-01 10:30:00+00:00,https://www.fool.com/investing/2024/05/01/1-unique-sp-500-etf-that-could-be-a-great-buy-now/?source=iedfolrf0000001,United States,English,fool.com
"Nasdaq , S & P 500 Futures Signal Weaker Open As Fed Decision Looms : What Going On With Markets ? - Invesco QQQ Trust , Series 1 ( NASDAQ : QQQ ), SPDR S & P 500 ( ARCA : SPY ) ",2024-05-01 11:30:00+00:00,https://www.benzinga.com/news/earnings/24/05/38544746/wall-street-set-to-open-lower-after-amd-earnings-disappoint-as-traders-look-to-feds-powell-for-reli,United States,English,benzinga.com
"If You Invested $5 , 000 in Nvidia Stock 10 Years Ago , This Is How Much You Would Have Now",2024-05-01 13:15:00+00:00,https://finance.yahoo.com/news/invested-5-000-nvidia-stock-123755400.html,United States,English,finance.yahoo.com
Market movers : Stocks seeing action on Wednesday - and why,2024-05-01 14:15:00+00:00,https://www.theglobeandmail.com/investing/markets/inside-the-market/article-market-movers-stocks-seeing-action-on-wednesday-may-1-and-why/,Canada,English,theglobeandmail.com
AMD is Down 35 %. Now is the Time to Buy the Dip,2024-05-01 16:00:00+00:00,https://biztoc.com/x/8179694e9c83e5a6,,English,biztoc.com
FTSE 100 live : Shares make nervous start to May ahead of Fed rate call,2024-05-01 16:15:00+00:00,https://www.proactiveinvestors.co.uk/companies/news/1046551/ftse-100-live-shares-make-nervous-start-to-may-ahead-of-fed-rate-call-1046551.html,United Kingdom,English,proactiveinvestors.co.uk
Nvidia Stock Drops After Rival AMD Gives Uninspiring Outlook,2024-05-01 18:00:00+00:00,https://www.investors.com:443/news/technology/nvidia-stock-drops-after-amd-gives-uninspiring-outlook/,United States,English,investors.com
"AMD Falls On Q1 Earnings , Q2 Guidance : Why  1 , 000 % Growth  From AI Stock Is Not Enough For Investors",2024-05-01 18:00:00+00:00,https://markets.businessinsider.com/news/stocks/amd-falls-on-q1-earnings-q2-guidance-why-1-000-growth-from-ai-stock-is-not-enough-for-investors-1033314772,United States,English,markets.businessinsider.com
Nvidia - backed CoreWeave nets $19bn valuation in latest finding round,2024-05-01 20:00:00+00:00,https://www.proactiveinvestors.co.uk/companies/news/1046629/nvidia-backed-coreweave-nets-19bn-valuation-in-latest-finding-round-1046629.html,United Kingdom,English,proactiveinvestors.co.uk
Nvidia ChatRTX Receives Major AI Update,2024-05-01 21:30:00+00:00,https://www.finanznachrichten.de/nachrichten-2024-05/62114205-nvidia-s-chatrtx-receives-major-ai-update-020.htm,Germany,English,finanznachrichten.de
NVIDIA Sets Conference Call for First - Quarter Financial Results,2024-05-01 21:30:00+00:00,https://www.tmcnet.com/usubmit/2024/05/01/10004196.htm,United States,English,tmcnet.com
Dow Jones Futures : Stock Market Round - Trips Fed Gains ; Carvana Skyrockets Late,2024-05-01 21:45:00+00:00,https://www.investors.com:443/market-trend/stock-market-today/dow-jones-futures-fed-powell-ai-plays-carvana-skyrockets/,United States,English,investors.com
"Why Nvidia , Arm Holdings , and Other Artificial Intelligence ( AI ) Stocks Slumped on Wednesday",2024-05-01 22:15:00+00:00,https://www.fool.com/investing/2024/05/01/why-nvidia-arm-holdings-and-other-artificial-intel/?source=iedfolrf0000001,United States,English,fool.com
"Semiconductor ETFs Struggle Amid Earnings Season : Strategies for Trading SMH , SSG",2024-05-01 23:00:00+00:00,https://moneymorning.com/2024/05/01/semiconductor-stocks-are-tired-make-these-two-trades-today/,United States,English,moneymorning.com
Nvidia Roller Coaster Ride Through Early 2024 Sets The Stage For A Potential Market Shakeup As Investors Eye The Critical First Quarter Earnings Report,2024-05-02 00:00:00+00:00,https://biztoc.com/x/48fa340890512506,,English,biztoc.com
Nvidia ChatRTX Receives Major AI Update,2024-05-02 00:30:00+00:00,https://www.rttnews.com/3443854/nvidia-s-chatrtx-receives-major-ai-update.aspx,United States,English,rttnews.com
Keeler Thomas Management LLC Trims Holdings in NVIDIA Co . ( NASDAQ : NVDA ) ,2024-05-02 00:30:00+00:00,https://www.etfdailynews.com/2024/05/01/keeler-thomas-management-llc-trims-holdings-in-nvidia-co-nasdaqnvda/,United States,English,etfdailynews.com
Diversified LLC Buys 308 Shares of NVIDIA Co . ( NASDAQ : NVDA ) ,2024-05-02 00:30:00+00:00,https://www.etfdailynews.com/2024/05/01/diversified-llc-buys-308-shares-of-nvidia-co-nasdaqnvda/,United States,English,etfdailynews.com
AMD Stock Is No Longer Dead Money ( Rating Upgrade ) ( NASDAQ : AMD ) ,2024-05-02 00:45:00+00:00,https://seekingalpha.com/article/4688140-amd-stock-is-no-longer-dead-money-rating-upgrade,United States,English,seekingalpha.com
A Beginner Guide to the Six Most Popular Stock Sectors,2024-05-02 01:00:00+00:00,https://www.insidermonkey.com/blog/a-beginners-guide-to-the-six-most-popular-stock-sectors-1295390/,United States,English,insidermonkey.com
Is the AMD Stock Plunge the Beginning of the End for Chip Stocks ? ,2024-05-02 01:45:00+00:00,https://investorplace.com/2024/05/is-the-amd-stock-plunge-the-beginning-of-the-end-for-chip-stocks/,United States,English,investorplace.com
3 Meme Stocks to Buy on the Dip : April 2024,2024-05-02 01:45:00+00:00,https://investorplace.com/2024/05/3-meme-stocks-to-buy-on-the-dip-april-2024/,United States,English,investorplace.com
Analysts revise SuperMicro stock price target after earnings,2024-05-02 02:00:00+00:00,https://www.news-daily.com/arena/thestreet/analysts-revise-supermicro-stock-price-target-after-earnings/article_089b92ac-5973-5478-b927-1b4389d456cb.html,United States,English,news-daily.com
"US close : Stocks fall after Fed comments , strong jobs data",2024-05-02 02:00:00+00:00,"https://www.hl.co.uk/shares/stock-market-news/market-reports/us-close-stocks-fall-after-fed-comments,-strong-jobs-data",United Kingdom,English,hl.co.uk
Analysts revise SuperMicro stock price target after earnings,2024-05-02 03:00:00+00:00,https://www.wenatcheeworld.com/arena/finance/analysts-revise-supermicro-stock-price-target-after-earnings/article_356391a9-53d6-5093-ac90-359a56e8617e.html,United States,English,wenatcheeworld.com
Nvidia Shares Plummet After Rough Outlook From AI Competitor,2024-05-02 05:30:00+00:00,http://www.hngn.com/articles/260246/20240501/nvidia-shares-plummet-rough-outlook-ai-competitor.htm,United States,English,hngn.com
11 Top - Performing Large - Blend Funds,2024-05-02 11:00:00+00:00,https://www.morningstar.com/funds/11-top-performing-large-blend-funds,China,English,morningstar.com
Stock Market Today : Dow Jones Rallies On Jobless Claims ; Apple Earnings Next,2024-05-02 14:30:00+00:00,https://www.investors.com/market-trend/stock-market-today/dow-jones-sp500-nasdaq-apple-aapl-stock-2/,United States,English,investors.com
"BILL Holdings to Report Q3 Earnings : What in Store ? - Arista Networks ( NYSE : ANET ), Adyen ( OTC : ADYEY ) ",2024-05-02 15:45:00+00:00,https://www.benzinga.com/news/earnings/24/05/38529958/bill-holdings-to-report-q3-earnings-whats-in-store,United States,English,benzinga.com
Apple earnings are more crucial to the stock market than Nvidia,2024-05-02 17:15:00+00:00,https://www.bendbulletin.com/business/finance/apple-earnings-are-more-crucial-to-the-stock-market-than-nvidia/article_6ad49c7e-45f7-52b2-851e-1f227a6b5181.html,United States,English,bendbulletin.com
Consider This Award - Winning Disruptive Tech ETF,2024-05-02 17:15:00+00:00,https://www.etftrends.com/etf-investing-channel/consider-award-winning-disruptive-tech-etf-fdtx/,China,English,etftrends.com
"Baystreet . ca - Thursday Stock Deals : Starbucks , AMD , and Super Micro Computer",2024-05-02 17:15:00+00:00,http://baystreet.ca/articles/stockstowatch/97170/Thursdays-Stock-Deals-Starbucks-AMD-and-Super-Micro-Computer,Canada,English,baystreet.ca
Baystreet . ca - Five of the Top Healthcare AI Stocks to Buy and Hold Today,2024-05-02 17:15:00+00:00,http://baystreet.ca/stockstowatch/17851/Five-of-the-Top-Healthcare-AI-Stocks-to-Buy-and-Hold-Today,Canada,English,baystreet.ca
"Will Nvidia Follow AMD , Intel , and Super Micro and Plummet After Reporting Earnings ? ",2024-05-02 18:00:00+00:00,https://biztoc.com/x/693a6e67c7276f34,,English,biztoc.com
Linde guidance leaves investors wanting more . Were saying thanks to the sellers,2024-05-02 18:15:00+00:00,https://www.cnbc.com/2024/05/02/lindes-guidance-leaves-investors-wanting-more-were-saying-thanks-to-the-sellers.html,United States,English,cnbc.com
"Semiconductor Stocks Pop After Fed Meeting And Strong Numbers From This Chip - Maker - Intel ( NASDAQ : INTC ), Advanced Micro Devices ( NASDAQ : AMD ) ",2024-05-02 19:45:00+00:00,https://www.benzinga.com/trading-ideas/long-ideas/24/05/38594177/semiconductor-stocks-pop-after-fed-meeting-and-strong-numbers-from-this-chip-maker,United States,English,benzinga.com
Semiconductor Stocks Pop After Fed Meeting And Strong Numbers From This Chip - Maker,2024-05-02 21:00:00+00:00,https://markets.businessinsider.com/news/etf/semiconductor-stocks-pop-after-fed-meeting-and-strong-numbers-from-this-chip-maker-1033321940,United States,English,markets.businessinsider.com
Nvidia Stock Is Still A Bargain ( NASDAQ : NVDA ) ,2024-05-02 23:15:00+00:00,https://seekingalpha.com/article/4688568-nvidia-stock-still-a-bargain,United States,English,seekingalpha.com
Here How Much It Would Cost to Build Your Own Personal Equal Weight  Magnificent Seven  ETF,2024-05-03 12:30:00+00:00,https://www.fool.com/investing/2024/05/03/heres-how-much-it-would-cost-to-build-your-own-per/,United States,English,fool.com
Stock Market Today : Dow Jones Rallies Ahead Of Jobs Report ; Apple Surges On Buyback News,2024-05-03 12:45:00+00:00,https://www.investors.com/market-trend/stock-market-today/dow-jones-futures-sp500-nasdaq-jobs-report-apple-aapl-earnings/,United States,English,investors.com
Morling Financial Advisors LLC Sells 145 Shares of NVIDIA Co . ( NASDAQ : NVDA ) ,2024-05-03 13:45:00+00:00,https://www.defenseworld.net/2024/05/03/morling-financial-advisors-llc-sells-145-shares-of-nvidia-co-nasdaqnvda.html,Russia,English,defenseworld.net
Carret Asset Management LLC Buys 68 Shares of NVIDIA Co . ( NASDAQ : NVDA ) ,2024-05-03 13:45:00+00:00,https://www.defenseworld.net/2024/05/03/carret-asset-management-llc-buys-68-shares-of-nvidia-co-nasdaqnvda.html,Russia,English,defenseworld.net
Amazon Web Services CEO : Were on track to hit $100 billion in sales in 2024,2024-05-03 13:45:00+00:00,https://www.aol.com/amazon-services-ceo-were-track-122551096.html,United States,English,aol.com
Magnolia Capital Advisors LLC Buys 544 Shares of NVIDIA Co . ( NASDAQ : NVDA ) ,2024-05-03 13:45:00+00:00,https://www.defenseworld.net/2024/05/03/magnolia-capital-advisors-llc-buys-544-shares-of-nvidia-co-nasdaqnvda.html,Russia,English,defenseworld.net
NVIDIA Co . ( NASDAQ : NVDA ) Stake Decreased by Hartline Investment Corp,2024-05-03 13:45:00+00:00,https://www.defenseworld.net/2024/05/03/nvidia-co-nasdaqnvda-stake-decreased-by-hartline-investment-corp.html,Russia,English,defenseworld.net
"After April Showers , Will Markets Flower ? ",2024-05-03 14:45:00+00:00,https://www.forbes.com/sites/moneyshow/2024/05/03/after-april-showers-will-markets-flower/,United States,English,forbes.com
4 Magnificent 7 Stocks Also Pay Investors Very Dependable Dividends,2024-05-03 15:45:00+00:00,https://247wallst.com/investing/2024/05/03/4-magnificent-7-stocks-also-pay-investors-very-dependable-dividends/,United States,English,247wallst.com
How Businesses Are Adapting to the Rapid Expansion of Artificial Intelligence,2024-05-03 16:15:00+00:00,https://www.newswire.ca/news-releases/how-businesses-are-adapting-to-the-rapid-expansion-of-artificial-intelligence-839439445.html,Canada,English,newswire.ca
The shift from active to passive equity funds is not reinforced by concentration - JPM,2024-05-03 17:15:00+00:00,https://seekingalpha.com/news/4099777-the-shift-from-active-to-passive-equity-funds-is-not-reinforced-by-concentration-jpm-analyst,United States,English,seekingalpha.com
Seize the Quantum Opportunity : Why You Should Buy IONQ Stock Before May 8,2024-05-03 19:45:00+00:00,https://investorplace.com/2024/05/seize-the-quantum-opportunity-why-you-should-buy-ionq-stock-before-may-8/,United States,English,investorplace.com
Cramer : Apple Vision Pro could add to earnings sooner than expected,2024-05-03 20:15:00+00:00,https://www.cnbc.com/2024/05/03/cramer-apples-vision-pro-could-add-to-earnings-sooner-than-expected-.html,United States,English,cnbc.com
Stock Market : Ferrari Leads Fast - Moving Stocks | Investor Business Daily,2024-05-03 23:30:00+00:00,https://www.investors.com/news/week-of-fast-moving-stocks-ahead/,United States,English,investors.com
"Dow Jones Futures : Stock Market Makes Bullish Move , Nvidia In Buy Area . Palantir , These AI Plays On Tap . ",2024-05-04 00:00:00+00:00,https://www.investors.com/market-trend/stock-market-today/dow-jones-futures-bullish-move-nvidia-in-buy-area-palantir-ai-plays/,United States,English,investors.com
NVIDIA ( NASDAQ : NVDA ) Stock Price Up 2 . 4 % ,2024-05-04 02:15:00+00:00,https://www.wkrb13.com/2024/05/04/nvidia-nasdaqnvda-stock-price-up-2-4.html,United States,English,wkrb13.com
3 Artificial Intelligence ( AI ) Stocks to Buy in May,2024-05-04 08:15:00+00:00,https://www.fool.com/investing/2024/05/02/3-artificial-intelligence-ai-stocks-to-buy-in-may/,United States,English,fool.com
Where Will Nvidia Stock Be in 5 Years ? ,2024-05-04 12:30:00+00:00,https://biztoc.com/x/bec152addc14932f,,English,biztoc.com
23 Most Profitable Stocks of the Last 12 Months,2024-05-04 13:30:00+00:00,https://www.insidermonkey.com/blog/23-most-profitable-stocks-of-the-last-12-months-1271361/,United States,English,insidermonkey.com
Should You Buy 1 Share of Each  Magnificent Seven  Stock ? ,2024-05-04 13:45:00+00:00,https://www.fool.com/investing/2024/05/04/should-you-buy-1-share-of-each-magnificent-seven-s/?source=iedfolrf0000001,United States,English,fool.com
A Once - in - a - Generation Investment : 1 AI Stock You Dont Want to Miss Out On,2024-05-04 15:45:00+00:00,https://247wallst.com/investing/2024/05/04/a-once-in-a-generation-investment-1-ai-stock-you-dont-want-to-miss-out-on/,United States,English,247wallst.com
Billionaire Stanley Druckenmiller Has 39 % of His Portfolio in These 3 Companies,2024-05-04 19:00:00+00:00,https://finance.yahoo.com/news/billionaire-stanley-druckenmiller-39-portfolio-121500882.html,United States,English,finance.yahoo.com
23 Most Profitable Stocks of the Last 12 Months,2024-05-04 20:15:00+00:00,https://finance.yahoo.com/news/23-most-profitable-stocks-last-113818389.html,United States,English,finance.yahoo.com
Warren Buffett cautions against role of AI in scamming people ( NYSE : BRK . A ) ,2024-05-04 21:15:00+00:00,https://seekingalpha.com/news/4100032-warren-buffett-cautions-against-role-of-ai-in-scamming-people,United States,English,seekingalpha.com
20 Countries with the Highest Annual GDP Growth in the World,2024-05-05 00:15:00+00:00,https://www.insidermonkey.com/blog/20-countries-with-the-highest-annual-gdp-growth-in-the-world-1287414/,United States,English,insidermonkey.com
Disney may give stocks reason to cheer,2024-05-05 07:30:00+00:00,https://www.bendbulletin.com/business/finance/disney-may-give-stocks-reason-to-cheer/article_92400baf-7dab-57f3-98a9-b81a1cd1ea2c.html,United States,English,bendbulletin.com
"Move Over , Nvidia : Billionaire Dan Loeb Is Betting on This Dividend - Paying Magnificent Seven Stock to Win the Artificial Intelligence ( AI ) Race Instead",2024-05-05 12:45:00+00:00,https://www.fool.com/investing/2024/05/05/move-over-nvidia-billionaire-dan-loeb-is-betting-o/,United States,English,fool.com
Think Nvidia Is Overvalued ? Buy This  Magnificent Seven  Stock Instead,2024-05-05 16:00:00+00:00,https://finance.yahoo.com/news/think-nvidia-overvalued-buy-magnificent-141500007.html,United States,English,finance.yahoo.com
Read This Before You Buy the Invesco QQQ Trust ETF,2024-05-05 16:30:00+00:00,https://www.fool.com/investing/2024/05/05/read-this-before-you-buy-the-invesco-qqq-trust-etf/,United States,English,fool.com
"3 Magnificent Technology ETFs to Buy With $10 , 000 and Hold Forever",2024-05-05 19:45:00+00:00,https://finance.yahoo.com/news/3-magnificent-technology-etfs-buy-181100155.html,United States,English,finance.yahoo.com
Earnings estimates for the Magnificent 7 are ramping up . What about the other 493 ? ,2024-05-06 01:30:00+00:00,https://seekingalpha.com/news/4100057-earnings-estimates-for-the-magnificent-7-ramping-up-what-about-the-other-493,United States,English,seekingalpha.com
Super Micro Computer : Reiterate Sell Despite Margin Improvement ( NASDAQ : SMCI ) ,2024-05-06 01:30:00+00:00,https://seekingalpha.com/article/4689548-super-micro-computer-reiterate-sell-despite-margin-improvement,United States,English,seekingalpha.com
"S & P 500 : Ready For The Squeeze , Week Starting 6th May ( Technical Analysis ) ( SP500 ) ",2024-05-06 06:30:00+00:00,https://seekingalpha.com/article/4689607-sp500-ready-for-squeeze-week-starting-6-may-technical-analysis,United States,English,seekingalpha.com
3 Top Stocks to Buy Now That Could Help You Retire a Millionaire,2024-05-06 06:45:00+00:00,https://www.fool.com/investing/2024/05/05/top-stocks-to-buy-now-help-you-retire-millionaire/,United States,English,fool.com
Apple earnings help market end week on high note,2024-05-06 08:30:00+00:00,https://www.fxstreet.com/news/apple-earnings-help-market-end-week-on-high-note-202405032110,China,English,fxstreet.com
Did Last Week Jobs Data Really Make a Case for Rate Cuts ? ,2024-05-06 09:00:00+00:00,https://www.investing.com/analysis/did-last-weeks-jobs-data-really-make-a-case-for-rate-cuts-200648157,United States,English,investing.com
Billionaires Are Selling Nvidia Stock and Buying 2 Top Index Funds That Beat the S & P 500 Over the Past Decade,2024-05-06 10:15:00+00:00,https://biztoc.com/x/090d16c210562324,,English,biztoc.com
"Instead of Buying Nvidia Stock , Im Buying This AI ETF Hand Over Fist",2024-05-06 13:00:00+00:00,https://www.fool.com/investing/2024/05/06/instead-of-buying-nvidia-stock-im-buying-this-ai-e/?source=iedfolrf0000001,United States,English,fool.com
Stock Market Crash Warning : Dont Get Caught AI Stocks to Avoid,2024-05-06 13:45:00+00:00,https://investorplace.com/2024/05/stock-market-crash-warning-dont-get-caught-holding-these-7-ai-stocks/,United States,English,investorplace.com
S & P 500 : Owning Just This One Stock Made Investors $1 Trillion Richer This Year,2024-05-06 15:00:00+00:00,https://www.investors.com/etfs-and-funds/sectors/sp500-owning-just-this-one-stock-made-investors-trillion-richer-this-year/,United States,English,investors.com
"Why Arista Networks , Advanced Micro Devices , and Arm Holdings Fell in April",2024-05-06 15:00:00+00:00,https://www.fool.com/investing/2024/05/06/why-arista-networks-advanced-micro-devices-and-arm/?source=iedfolrf0000001,United States,English,fool.com
Stock Market Today : Dow Jones Rises Ahead Of Fed Speeches ; Warren Buffett Stock Falls,2024-05-06 15:15:00+00:00,https://www.investors.com:443/market-trend/stock-market-today/dow-jones-sp500-nasdaq-warren-buffett/,United States,English,investors.com
Why only five of the Magnificent Seven stocks are buys,2024-05-06 15:30:00+00:00,https://www.theglobeandmail.com/investing/markets/inside-the-market/article-gordon-pape-why-only-five-of-the-magnificent-seven-stocks-are-buys/,Canada,English,theglobeandmail.com
Wall Street Breakfast : The Final Frontier,2024-05-06 20:45:00+00:00,https://seekingalpha.com/article/4689729-wall-street-breakfast-final-frontier,United States,English,seekingalpha.com
Warren Buffett compares AI to nuclear weapons in stark warning,2024-05-06 20:45:00+00:00,https://us.cnn.com/2024/05/06/investing/warren-buffett-compares-ai-nuclear-weapons/,United States,English,us.cnn.com
Warren Buffett compares AI to nuclear weapons in stark warning,2024-05-06 23:00:00+00:00,https://ktvz.com/money/cnn-business-consumer/2024/05/06/warren-buffett-compares-ai-to-nuclear-weapons-in-stark-warning/,United States,English,ktvz.com
"Schwab Customers Ran To Nvidia Stock , These Others Amid Bumpy April Market Meltdown",2024-05-07 02:45:00+00:00,https://www.investors.com/research/nvidia-stock-microsoft-amazon/,United States,English,investors.com
Forget Nvidia : Smart Money Is Selling It and Buying These 2 Roaring Artificial Intelligence ( AI ) Stocks Instead,2024-05-07 03:30:00+00:00,https://www.fool.com/investing/2024/05/06/forget-nvidia-smart-money-is-selling-it-and-buying/,United States,English,fool.com
Warren Buffett compares AI to nuclear weapons in stark warning,2024-05-07 04:15:00+00:00,https://edition.cnn.com/2024/05/06/investing/warren-buffett-compares-ai-nuclear-weapons/,United States,English,edition.cnn.com
Palantir Stock Pops Then Drops As Investors Digest Q1 2024 Report ( NYSE : PLTR ) ,2024-05-07 04:15:00+00:00,https://seekingalpha.com/article/4689906-palantir-stock-pops-then-drops-as-investors-digest-q1-2024-report,United States,English,seekingalpha.com
The 3 Most Undervalued Semiconductor Stocks to Buy in May 2024,2024-05-07 04:30:00+00:00,https://investorplace.com/2024/05/the-3-most-undervalued-semiconductor-stocks-to-buy-in-may-2024/,United States,English,investorplace.com
AMD Stock : Investors Needed More Than Just a Solid Quarter,2024-05-07 04:30:00+00:00,https://finance.yahoo.com/news/amd-stock-investors-needed-more-034457267.html,United States,English,finance.yahoo.com
Amazon to spend nearly $9 bln to expand cloud infra in Singapore,2024-05-07 07:45:00+00:00,https://in-cyprus.philenews.com/insider/business/amazon-to-spend-nearly-9-bln-to-expand-cloud-infra-in-singapore/,Cyprus,English,in-cyprus.philenews.com
Artificial Intelligence ( AI ) Tokens Lead Crypto - Market Recovery as Nvidia ( NVDA ) Share Price Hits One - Month High,2024-05-07 11:00:00+00:00,https://www.coindesk.com/markets/2024/05/07/ai-tokens-lead-crypto-market-recovery-as-nvidia-hits-one-month-high/,United States,English,coindesk.com
Amazon plans to invest nearly $9B to boost cloud infrastructure in Singapore,2024-05-07 11:00:00+00:00,https://seekingalpha.com/news/4100901-amazon-plans-to-invest-nearly-9b-to-boost-cloud-infrastructure-in-singapore,United States,English,seekingalpha.com
"Nvidia Joins $1 . 05B Wayve Funding , Advances Automated Driving",2024-05-07 11:45:00+00:00,https://biztoc.com/x/53f37bbc518e02f5,,English,biztoc.com
"Nvidia Joins $1 . 05B Wayve Funding , Advances Automated Driving - NVIDIA ( NASDAQ : NVDA ) ",2024-05-07 11:45:00+00:00,https://www.benzinga.com/markets/equities/24/05/38663973/nvidia-joins-1-05b-wayve-funding-advances-automated-driving,United States,English,benzinga.com
"Nvidia Stock : Fairly Valued , But Potential Huge Annual Returns Persist ( NASDAQ : NVDA ) ",2024-05-07 12:00:00+00:00,https://seekingalpha.com/article/4689921-nvidia-stock-airly-valued-but-potential-huge-annual-returns-persist,United States,English,seekingalpha.com
Forget Nvidia : Buy These 2 Hypergrowth Artificial Intelligence ( AI ) Stocks Instead,2024-05-07 12:00:00+00:00,https://www.fool.com/investing/2024/05/07/forget-nvidia-buy-2-hypergrowth-ai-stocks-instead/?source=iedfolrf0000001,United States,English,fool.com
Amazon to Spend Nearly $9bn to Expand Cloud Infra in Singapore,2024-05-07 12:30:00+00:00,https://en.tempo.co/read/1865011/amazon-to-spend-nearly-9bn-to-expand-cloud-infra-in-singapore,,English,en.tempo.co
Stock Market Today : Dow Jones Rises As Disney Dives On Sales Miss ; Palantir Plunges On Earnings,2024-05-07 12:45:00+00:00,https://www.investors.com/market-trend/stock-market-today/dow-jones-sp500-nasdaq-disney-stock-dis-palantir-pltr/,United States,English,investors.com
Americans have spent their savings . Economists worry about what comes next,2024-05-07 13:00:00+00:00,https://www.cnn.com/2024/05/07/investing/premarket-stocks-trading/,United States,English,cnn.com
Americans have spent their savings . Economists worry about what comes next,2024-05-07 13:15:00+00:00,https://us.cnn.com/2024/05/07/investing/premarket-stocks-trading/,United States,English,us.cnn.com
Americans have spent their savings . Economists worry about what comes next,2024-05-07 13:45:00+00:00,https://finance.yahoo.com/news/americans-spent-savings-economists-worry-113203731.html,United States,English,finance.yahoo.com
Americans have spent their savings . Economists worry about what comes next,2024-05-07 13:45:00+00:00,https://edition.cnn.com/2024/05/07/investing/premarket-stocks-trading/,United States,English,edition.cnn.com
This Company Has the Most Profits Per Employee,2024-05-07 15:30:00+00:00,https://247wallst.com/investing/2024/05/07/this-company-has-the-most-profits-per-employee-3/,United States,English,247wallst.com
Cocky Bears Outmatched : Tech Triumphs - The Daily Reckoning,2024-05-07 16:45:00+00:00,https://dailyreckoning.com/cocky-bears-outmatched-tech-triumphs/,United States,English,dailyreckoning.com
2 Top Artificial Intelligence ( AI ) Stocks to Buy in May,2024-05-07 18:00:00+00:00,https://www.fool.com/investing/2024/05/07/2-top-artificial-intelligence-ai-stocks-to-buy-in/?source=iedfolrf0000001,United States,English,fool.com
"Research Analyst Price Target Changes for May 7th ( ACM , ADCT , ADNT , ADUS , AL , ALB , ALG , ALNY , AMG , AMR ) ",2024-05-07 18:15:00+00:00,https://www.dailypolitical.com/2024/05/07/research-analysts-price-target-changes-for-may-7th-acm-adct-adnt-adus-al-alb-alg-alny-amg-amr.html,United States,English,dailypolitical.com
