title,seendate,url,sourcecountry,language,domain
Large Cap Stocks To Add to Your Watchlist – March 16th,2025-03-17 12:30:00+00:00,https://www.modernreaders.com/news/2025/03/17/large-cap-stocks-to-add-to-your-watchlist-march-16th.html,United States,English,modernreaders.com
4 Phenomenal Chip Companies to Ride the Artificial Intelligence ( AI ) Investing Wave,2025-03-17 12:45:00+00:00,https://www.fool.com/investing/2025/03/17/4-phenomenal-chip-companies-to-ride-the-artificial/?source=iedfolrf0000001,United States,English,fool.com
Nvidia Top AI Event Is Here : Will Nvidia Stock Rise During March 18 Through March 21 ? ,2025-03-17 12:45:00+00:00,https://www.fool.com/investing/2025/03/17/nvda-stock-gtc-2025-ai-stocks/?source=iedfolrf0000001,United States,English,fool.com
S & P 500 : This Billionaire Is The Biggest Loser From $3 . 3 Trillion Trump Dump,2025-03-17 12:45:00+00:00,https://www.investors.com/etfs-and-funds/sectors/sp500-billionaire-is-the-biggest-loser-from-trillion-trump-dump/,United States,English,investors.com
Monday Wall Street analyst calls to watch like Nvidia,2025-03-17 13:30:00+00:00,https://www.cnbc.com/2025/03/17/mondays-wall-street-analyst-calls-to-watch-like-nvidia.html,United States,English,cnbc.com
"Stock market today : Dow , S & P 500 , Nasdaq futures waver as Bessent dismisses sell - off , retail sales miss",2025-03-17 13:30:00+00:00,https://finance.yahoo.com/news/live/stock-market-today-dow-sp-500-nasdaq-futures-waver-as-bessent-dismisses-sell-off-retail-sales-miss-233621318.html,United States,English,finance.yahoo.com
Nvidia Top AI Event Is Here : Will Nvidia Stock Rise During March 18 Through March 21 ? ,2025-03-17 14:15:00+00:00,https://www.fool.com/investing/2025/03/17/nvda-stock-gtc-2025-ai-stocks/,United States,English,fool.com
Quantum Computing Stocks Are Rallying Monday : What Going On ? ,2025-03-17 15:30:00+00:00,https://biztoc.com/x/7f4076664b07cea0,,English,biztoc.com
NVIDIA ( NASDAQ : NVDA ) Trading Down 2 % Following Analyst Downgrade,2025-03-17 16:00:00+00:00,https://www.themarketsdaily.com/2025/03/17/nvidia-nasdaqnvda-trading-down-2-following-analyst-downgrade.html,United States,English,themarketsdaily.com
Baystreet . ca - Why Nvidia GTC could be a negative for Marvell and other optical stocks,2025-03-17 16:15:00+00:00,http://baystreet.ca/investing/109596/Why-Nvidias-GTC-could-be-a-negative-for-Marvell-and-other-optical-stocks,Canada,English,baystreet.ca
Baystreet . ca - AI Bubble Watch for Mid - March 2025,2025-03-17 16:15:00+00:00,http://baystreet.ca/stockstowatch/20383/AI-Bubble-Watch-for-Mid-March-2025,Canada,English,baystreet.ca
"US Stocks Likely To Open Lower As Futures Decline :  Stay Calm And Stick With Your Long - Term Plan , Says Expert Amid Correction Woes - Castellum ( AMEX : CTM ), Consolidated Water Co ( NASDAQ : CWCO ) ",2025-03-17 17:00:00+00:00,https://www.benzinga.com/25/03/44351741/us-stocks-likely-to-open-lower-as-futures-decline-stay-calm-and-stick-with-your-long-term-plan-says-expert-amid-c,United States,English,benzinga.com
CoreWeave IPO : Should You Buy CRWV Stock ? ,2025-03-17 17:00:00+00:00,https://www.kiplinger.com/investing/ipos/coreweave-ipo-should-you-buy-crwv-stock,United States,English,kiplinger.com
Nvidia GPT conference is here : What analysts are saying,2025-03-17 17:00:00+00:00,https://qz.com/nvidia-gtc-gpu-conference-blackwell-ultra-rubin-ai-chip-1851770370,United States,English,qz.com
Comparative Study : NVIDIA And Industry Competitors In Semiconductors & Semiconductor Equipment Industry,2025-03-17 17:00:00+00:00,https://biztoc.com/x/90b86f2e1a5774a6,,English,biztoc.com
"Hyperfine , Nvidia Partner To Make Brain MRIs More Affordable",2025-03-17 17:00:00+00:00,https://biztoc.com/x/43e149ae1b2e7602,,English,biztoc.com
3 Things Nvidia Investors Might Expect from the GTC 2025 Conference,2025-03-17 17:45:00+00:00,https://markets.financialcontent.com/stocks/article/marketminute-2025-3-17-3-things-nvidia-investors-might-expect-from-the-gtc-2025-conference,United States,English,markets.financialcontent.com
Arqit leads quantum computing stocks higher ahead of Nvidia GTC event,2025-03-17 17:45:00+00:00,https://seekingalpha.com/news/4421283-arqit-leads-quantum-computing-stocks-higher-ahead-of-nvidias-gtc-event,United States,English,seekingalpha.com
Intel new CEO plots overhaul of manufacturing and AI operations,2025-03-17 18:00:00+00:00,https://www.moneycontrol.com/news/business/intel-s-new-ceo-plots-overhaul-of-manufacturing-and-ai-operations-12967221.html,India,English,moneycontrol.com
Was Jim Cramer Right About These 13 Stocks ? ,2025-03-17 18:15:00+00:00,https://www.insidermonkey.com/blog/was-jim-cramer-right-about-these-13-stocks-2-1483421/,United States,English,insidermonkey.com
"Wall Street Losing Streak Deepens , But These 5 ETFs Defy The Slump - T - Rex 2X Inverse Ether Daily Target ETF ( BATS : ETQ ), Intel ( NASDAQ : INTC ) ",2025-03-17 19:15:00+00:00,https://www.benzinga.com/25/03/44362589/wall-streets-losing-streak-deepened-last-week-but-these-5-etfs-defied-the-slump,United States,English,benzinga.com
"Nvidia GTC And Quantum Computing Drivers Of The Stock Market , Trump Put Fails But May Not Be Dead",2025-03-17 20:00:00+00:00,https://www.benzinga.com/markets/equities/25/03/44358431/nvidia-gtc-and-quantum-computing-drivers-of-the-stock-market-trump-put-fails-but-may-not-be-dead,United States,English,benzinga.com
Nvidia Stock Price Outlook : GTC Conference Could Give NVDA Shares Boost,2025-03-17 20:15:00+00:00,https://www.businessinsider.com/nvidia-stock-price-prediction-nvda-gtc-conference-blackwell-gpu-chips-2025-3,United States,English,businessinsider.com
AMD Stock Climbs as Chipmaker Gaming GPUs Gain Market Share in Japan,2025-03-17 21:00:00+00:00,https://www.investopedia.com/amd-stock-climbs-as-chipmaker-gaming-gpus-gain-market-share-in-japan-11698534,United States,English,investopedia.com
3 high - yield ASX ETFs to supercharge your income stream,2025-03-17 21:15:00+00:00,https://www.fool.com.au/2025/03/18/3-high-yield-asx-etfs-to-supercharge-your-income-stream/,Australia,English,fool.com.au
Stock Market Today : Dow Adds 353 Points Despite Soft Retail Sales,2025-03-17 22:00:00+00:00,https://www.kiplinger.com/investing/stocks/stock-market-today-dow-adds-another-353-points-despite-soft-data,United States,English,kiplinger.com
The Art Of The ( Trade ) Deal,2025-03-17 22:15:00+00:00,https://seekingalpha.com/article/4768083-the-art-of-the-trade-deal,United States,English,seekingalpha.com
Jim Cramer Says NVIDIA ( NVDA ) Numbers Were  Excellent  ,2025-03-17 22:15:00+00:00,https://www.insidermonkey.com/blog/jim-cramer-says-nvidias-nvda-numbers-were-excellent-1484463/,United States,English,insidermonkey.com
What analysts are saying - ChinaTechNews . com,2025-03-17 23:30:00+00:00,https://www.chinatechnews.com/2025/03/17/110506-what-analysts-are-saying,China,English,chinatechnews.com
10 Firms Kick Off Monday Leading Gains - Insider Monkey,2025-03-17 23:30:00+00:00,https://www.insidermonkey.com/blog/10-firms-kick-off-monday-leading-gains-1484674/,United States,English,insidermonkey.com
Tuesday big stock stories : What likely to move the market,2025-03-18 00:00:00+00:00,https://www.cnbc.com/2025/03/17/tuesdays-big-stock-stories-whats-likely-to-move-the-market.html,United States,English,cnbc.com
Why NVIDIA Corporation ( NVDA ) is One of the Best Strong Buy Stocks to Buy Right Now,2025-03-18 01:00:00+00:00,https://www.insidermonkey.com/blog/why-nvidia-corporation-nvda-is-one-of-the-best-strong-buy-stocks-to-buy-right-now-1484695/,United States,English,insidermonkey.com
2 Top Artificial Intelligence Stocks to Buy Right Now,2025-03-18 01:45:00+00:00,https://www.fool.com/investing/2025/03/17/2-top-artificial-intelligence-stocks-buy-right-now/?source=iedfolrf0000001,United States,English,fool.com
Bullish about artificial intelligence and robotics ? Buy this ASX ETF,2025-03-18 02:00:00+00:00,https://www.fool.com.au/2025/03/18/bullish-about-artificial-intelligence-and-robotics-buy-this-asx-etf/,Australia,English,fool.com.au
2 Top Artificial Intelligence Stocks to Buy Right Now,2025-03-18 02:00:00+00:00,https://www.fool.com/investing/2025/03/17/2-top-artificial-intelligence-stocks-buy-right-now/,United States,English,fool.com
Jim Cramer Calls NVIDIA Corporation ( NVDA ) GTC the Woodstock of AI – And He Not Missing It,2025-03-18 02:30:00+00:00,https://www.insidermonkey.com/blog/jim-cramer-calls-nvidia-corporation-nvdas-gtc-the-woodstock-of-ai-and-hes-not-missing-it-1484833/,United States,English,insidermonkey.com
US close : Stocks rise again as traders  buy the dip  ,2025-03-18 03:30:00+00:00,https://www.sharecast.com/news/market-report-us-close/us-close-stocks-rise-again-as-traders-buy-the-dip--19162645.html,United Kingdom,English,sharecast.com
Stocks Sell Off : 2 Top Tech Stocks to Buy in March,2025-03-18 09:15:00+00:00,https://www.fool.com/investing/2025/03/18/stocks-sell-off-2-top-tech-stocks-to-buy-in-march/?source=iedfolrf0000001,United States,English,fool.com
Nasdaq Correction : 3 Artificial Intelligence ( AI ) Stocks That Could Make You a Millionaire,2025-03-18 11:45:00+00:00,https://www.fool.com/investing/2025/03/18/nasdaq-correction-3-artificial-intelligence-ai-sto/,United States,English,fool.com
Where Will Nvidia Be in 1 Year ? | The Motley Fool,2025-03-18 12:00:00+00:00,https://www.fool.com/investing/2025/03/18/where-will-nvidia-be-in-1-year/,United States,English,fool.com
"Nvidia rebound could be good sign for Trump trade talks , Tom Lee says",2025-03-18 15:00:00+00:00,https://www.cnbc.com/2025/03/18/nvidias-rebound-could-be-good-sign-for-trump-trade-talks-tom-lee-says.html,United States,English,cnbc.com
Stock market today : Nasdaq leads stocks lower as Nvidia drops ahead of GTC event,2025-03-18 15:00:00+00:00,https://finance.yahoo.com/news/live/stock-market-today-nasdaq-leads-stocks-lower-as-nvidia-drops-ahead-of-gtc-event-142433746.html,United States,English,finance.yahoo.com
Nvidia GTC event could be a  wake - up moment  for investors as the AI trade falters,2025-03-18 15:00:00+00:00,https://finance.yahoo.com/news/nvidias-gtc-event-could-be-a-wake-up-moment-for-investors-as-the-ai-trade-falters-134709271.html,United States,English,finance.yahoo.com
Why Nvidia stock holds the key to unlocking a rejuvenated market,2025-03-18 15:00:00+00:00,https://finance.yahoo.com/news/why-nvidia-stock-holds-the-key-to-unlocking-a-rejuvenated-market-123646743.html,United States,English,finance.yahoo.com
Livestream : Nvidia CEO Jensen Huang introduces new AI chips at GTC,2025-03-18 17:15:00+00:00,https://qz.com/nvidia-ceo-jensen-huang-gtc-blackwell-rubin-ai-chips-1851770700,United States,English,qz.com
General Motors and NVIDIA Collaborate on AI for,2025-03-18 18:30:00+00:00,https://www.globenewswire.com/news-release/2025/03/18/3044881/0/en/General-Motors-and-NVIDIA-Collaborate-on-AI-for-Next-Generation-Vehicle-Experience-and-Manufacturing.html,United States,English,globenewswire.com
NVIDIA Launches Family of Open Reasoning AI Models for Developers and Enterprises to Build Agentic AI Platforms,2025-03-18 19:30:00+00:00,https://www.marketscreener.com/quote/stock/NVIDIA-CORPORATION-57355629/news/NVIDIA-Launches-Family-of-Open-Reasoning-AI-Models-for-Developers-and-Enterprises-to-Build-Agentic-A-49366334/,,English,marketscreener.com
"NVIDIA Announces Spectrum - X Photonics , Co - Packaged Optics Networking Switches to Scale AI Factories to Millions of GPUs",2025-03-18 19:45:00+00:00,https://www.manilatimes.net/2025/03/19/tmt-newswire/globenewswire/nvidia-announces-spectrum-x-photonics-co-packaged-optics-networking-switches-to-scale-ai-factories-to-millions-of-gpus/2075628,Philippines,English,manilatimes.net
NVIDIA and Storage Industry Leaders Unveil New Class of Enterprise Infrastructure for the Age of AI,2025-03-18 19:45:00+00:00,https://www.marketscreener.com/quote/stock/NVIDIA-CORPORATION-57355629/news/NVIDIA-and-Storage-Industry-Leaders-Unveil-New-Class-of-Enterprise-Infrastructure-for-the-Age-of-AI-49366395/,,English,marketscreener.com
"Climate Tech Companies Adopt NVIDIA Earth - 2 for High - Resolution , Energy - Efficient , More Accurate Weather Predictions and Disaster Preparedness",2025-03-18 19:45:00+00:00,https://www.marketscreener.com/quote/stock/NVIDIA-CORPORATION-57355629/news/Climate-Tech-Companies-Adopt-NVIDIA-Earth-2-for-High-Resolution-Energy-Efficient-More-Accurate-Wea-49366399/,,English,marketscreener.com
"NVIDIA , Alphabet and Google Collaborate on the Future of Agentic and Physical AI",2025-03-18 19:45:00+00:00,https://www.marketscreener.com/quote/stock/NVIDIA-CORPORATION-57355629/news/NVIDIA-Alphabet-and-Google-Collaborate-on-the-Future-of-Agentic-and-Physical-AI-49366400/,,English,marketscreener.com
"NVIDIA , Alphabet and Google Collaborate on the Future of Agentic and Physical AI",2025-03-18 20:30:00+00:00,https://www.manilatimes.net/2025/03/19/tmt-newswire/globenewswire/nvidia-alphabet-and-google-collaborate-on-the-future-of-agentic-and-physical-ai/2075653,Philippines,English,manilatimes.net
Large Cap Stocks To Add to Your Watchlist – March 18th,2025-03-18 20:30:00+00:00,https://www.dailypolitical.com/2025/03/18/large-cap-stocks-to-add-to-your-watchlist-march-18th.html,United States,English,dailypolitical.com
NVIDIA to Build Accelerated Quantum Computing Research Center,2025-03-18 20:30:00+00:00,https://www.manilatimes.net/2025/03/19/tmt-newswire/globenewswire/nvidia-to-build-accelerated-quantum-computing-research-center/2075648,Philippines,English,manilatimes.net
NVIDIA and GE HealthCare Collaborate to Advance the Development of Autonomous Diagnostic Imaging With Physical AI,2025-03-18 20:30:00+00:00,https://www.manilatimes.net/2025/03/19/tmt-newswire/globenewswire/nvidia-and-ge-healthcare-collaborate-to-advance-the-development-of-autonomous-diagnostic-imaging-with-physical-ai/2075650,Philippines,English,manilatimes.net
"Telus , Nvidia announce plans to develop  sovereign AI factory  in Quebec",2025-03-18 21:15:00+00:00,https://www.thereminder.ca/the-mix/telus-nvidia-announce-plans-to-develop-sovereign-ai-factory-in-quebec-10393226,Canada,English,thereminder.ca
D - Wave Quantum Shares Traded Lower Tuesday : What Happened ? ,2025-03-18 21:30:00+00:00,https://biztoc.com/x/ab500681817029cc,,English,biztoc.com
Stock Market Today : Stocks Skid Into Another Risk - Off Turn,2025-03-18 21:30:00+00:00,https://www.kiplinger.com/investing/stocks/stock-market-today-stocks-skid-into-another-risk-off-turn,United States,English,kiplinger.com
"Telus , Nvidia announce plans to develop  sovereign AI factory  in Quebec",2025-03-18 22:00:00+00:00,https://www.wellandtribune.ca/business/telus-nvidia-announce-plans-to-develop-sovereign-ai-factory-in-quebec/article_e8659602-ab64-5f96-af45-23725dc14f31.html,Canada,English,wellandtribune.ca
"Nvidia stock sinks as CEO Jensen Huang keynotes GTC 2025 event , unveils new chip lineup",2025-03-18 22:00:00+00:00,https://finance.yahoo.com/news/nvidia-stock-sinks-as-ceo-jensen-huang-keynotes-gtc-2025-event-unveils-new-chip-lineup-134709250.html,United States,English,finance.yahoo.com
Analyst Says NVIDIA ( NVDA ) AI Pipeline is  Very Much Real  Across Multiple Industries,2025-03-18 22:00:00+00:00,https://www.insidermonkey.com/blog/analyst-says-nvidia-nvda-ai-pipeline-is-very-much-real-across-multiple-industries-1485950/,United States,English,insidermonkey.com
D - Wave Quantum Shares Traded Lower Tuesday : What Happened ? - D - Wave Quantum ( NYSE : QBTS ) ,2025-03-18 22:30:00+00:00,https://www.benzinga.com/trading-ideas/movers/25/03/44385434/d-wave-quantum-shares-traded-lower-tuesday-what-happened,United States,English,benzinga.com
Dow Jones falls as Fed rate call looms ahead,2025-03-18 22:45:00+00:00,https://www.fxstreet.com/news/dow-jones-industrial-average-slips-once-again-as-us-stocks-ease-202503181836,China,English,fxstreet.com
"Nvidia Shares up Over 3 % After Key Signal , Reversing Early Decline - NVIDIA ( NASDAQ : NVDA ) ",2025-03-18 23:30:00+00:00,https://www.benzinga.com/markets/equities/25/03/44388080/nvidia-shares-up-over-3-after-key-signal-reversing-early-decline,United States,English,benzinga.com
"Tesla Takes Another Hit With Nvidia , GM Self - Driving Partnership - Tesla ( NASDAQ : TSLA ) ",2025-03-19 00:30:00+00:00,https://www.benzinga.com/news/large-cap/25/03/44389027/tesla-takes-another-hit-with-nvidia-gm-self-driving-partnership,United States,English,benzinga.com
"NVIDIA ( NVDA ) & General Motors ( GM ) announce AI , factory & next - gen vehicle deal",2025-03-19 00:45:00+00:00,https://www.shacknews.com/article/143522/nvidia-nvda-gm-ai-factory-vehicle-deal,United States,English,shacknews.com
"Telus , Nvidia announce plans to develop  sovereign AI factory  in Quebec",2025-03-19 00:45:00+00:00,https://energeticcity.ca/2025/03/18/telus-nvidia-announce-plans-to-develop-sovereign-ai-factory-in-quebec/,Canada,English,energeticcity.ca
Is This the Long - Awaited Comeback for International - Stock Funds ? ,2025-03-19 02:45:00+00:00,https://www.morningstar.com/funds/is-this-long-awaited-comeback-international-stock-funds,China,English,morningstar.com
"Nvidia AI Boom Just Beginning As Blackwell Gains Traction And Rubin Ultra Raises The Power Bar , Says Gene Munster :  Investors Are Still Skeptical  ",2025-03-19 02:45:00+00:00,https://biztoc.com/x/31f9c57f58e4eb81,,English,biztoc.com
Stock Market Timer With $130K Cash Reserve Debates NVDA Investment –  Should I Do It Differently ? Or Stick To His High - Stakes Plan ? - NVIDIA ( NASDAQ : NVDA ) ,2025-03-19 03:00:00+00:00,https://www.benzinga.com/personal-finance/25/03/44390125/stock-market-timer-with-130k-cash-reserve-debates-nvda-investment-should-i-do-it-differently-or-stick-to-his-high-stakes-plan,United States,English,benzinga.com
"Bitcoin , Ethereum Flat , Dogecoin Falls Amid Trump - Putin Call : Analyst Says New BTC High At $111 , 000 Possible If This Happens - Grayscale Bitcoin Mini Trust ( BTC ) Common units of fractional undivided beneficial interest ( ARCA : BTC ) ",2025-03-19 03:00:00+00:00,https://www.benzinga.com/25/03/44390084/bitcoin-ethereum-flat-dogecoin-falls-amid-trump-putin-call-on-ukraine-war-analyst-says-high-whale-accumulation-could-support-btcs-price,United States,English,benzinga.com
Jensen Huang Unveils Nvidia Upcoming A . I . Chips at GTC : What to Know,2025-03-19 03:45:00+00:00,https://observer.com/2025/03/nvidia-unveils-blackwell-rubin-gtc/,United States,English,observer.com
US close : Tech stocks lead markets lower as Fed meeting looms,2025-03-19 04:00:00+00:00,https://www.sharecast.com/news/market-report-us-close/us-close-tech-stocks-lead-markets-lower-as-fed-meeting-looms--19171286.html,United Kingdom,English,sharecast.com
"UPDATE -- NVIDIA , Alphabet and Google Collaborate on the",2025-03-19 04:15:00+00:00,https://www.globenewswire.com/news-release/2025/03/19/3045095/0/en/UPDATE-NVIDIA-Alphabet-and-Google-Collaborate-on-the-Future-of-Agentic-and-Physical-AI.html,United States,English,globenewswire.com
Nvidia Stock Dropped After CEO Delivered GTC Keynote Watch These Key Levels,2025-03-19 05:15:00+00:00,https://www.investopedia.com/nvidia-stock-dropped-after-ceo-delivered-gtc-keynote-watch-these-key-levels-11699529,United States,English,investopedia.com
"Nvidia AI Boom Just Beginning As Blackwell Gains Traction And Rubin Ultra Raises The Power Bar , Says Gene Munster :  Investors Are Still Skeptical  - General Motors ( NYSE : GM ), Amazon . com ( NASDAQ : AMZN ) ",2025-03-19 05:45:00+00:00,https://www.benzinga.com/markets/equities/25/03/44390083/nvidia-ai-boom-just-beginning-as-blackwell-gains-traction-and-rubin-ultra-raises-the-power-bar-says-gene-munster-investors-are-still-skeptical,United States,English,benzinga.com
Where will Nvidia be in 1 year ? ,2025-03-19 07:15:00+00:00,https://www.fool.com.au/2025/03/19/where-will-nvidia-be-in-1-year-usfeed/,Australia,English,fool.com.au
Best Metaverse Stocks To Watch Now – March 17th,2025-03-19 07:30:00+00:00,https://www.etfdailynews.com/2025/03/19/best-metaverse-stocks-to-watch-now-march-17th/,United States,English,etfdailynews.com
Should You Buy Nvidia Stock Before March 21 ? History Has a Surprising Answer . ,2025-03-19 08:45:00+00:00,https://www.fool.com/investing/2025/03/19/buy-nvidia-stock-before-march-21-surprising-answer/?source=iedfolrf0000001,United States,English,fool.com
Ryan Stock : Company Leads Breakout Brigade Of Insurance Firms | Investor Business Daily,2025-03-19 12:45:00+00:00,https://www.investors.com/research/ryan-specialty-stock-insurance-stocks/,United States,English,investors.com
Top Wall Street stocks by analysts Wednesday like Nvidia,2025-03-19 12:45:00+00:00,https://www.cnbc.com/2025/03/19/top-wall-street-stocks-by-analysts-wednesday-like-nvidia.html,United States,English,cnbc.com
"Stock market today : Nasdaq leads stocks lower , Nvidia falls over 3 % as tech rout resumes ahead of Fed decision",2025-03-19 12:45:00+00:00,https://finance.yahoo.com/news/live/stock-market-today-nasdaq-leads-stocks-lower-nvidia-falls-over-3-as-tech-rout-resumes-ahead-of-fed-decision-200344705.html,United States,English,finance.yahoo.com
Nvidia GTC shows it keeps  pushing the envelope  in AI : analysts ( NVDA : NASDAQ ) ,2025-03-19 13:00:00+00:00,https://seekingalpha.com/news/4422074-nvidias-gtc-show-it-keeps-pushing-the-envelope-in-ai-analysts,United States,English,seekingalpha.com
New AI bet from tech upstart could be a major blow to Nvidia,2025-03-19 13:00:00+00:00,https://biztoc.com/x/a7011508bde47adc,,English,biztoc.com
"Bronstein , Gewirtz & Grossman , LLC Is Investigating NVIDIA Corporation ... ",2025-03-19 15:00:00+00:00,https://www.pr-inside.com/bronstein-gewirtz-grossman-llc-is-investigating-nvidia-corporation-r5083818.htm,United States,English,pr-inside.com
"Dow Jones Today : Stocks Rise Ahead of Federal Reserve Interest Rate Decision , Economic Forecasts ; Tesla Rebounds",2025-03-19 15:15:00+00:00,https://www.investopedia.com/dow-jones-today-03192025-11699583,United States,English,investopedia.com
Nvidia acquires synthetic data provider Gretel,2025-03-19 17:30:00+00:00,https://seekingalpha.com/news/4422293-nvidia-acquires-synthetic-data-provider-gretel,United States,English,seekingalpha.com
Nvidia And The Super Bowl Of AI ( undefined : NVDA ) ,2025-03-19 17:30:00+00:00,https://seekingalpha.com/article/4768583-nvidia-and-the-super-bowl-of-ai,United States,English,seekingalpha.com
"Equities Research Analyst Updated EPS Estimates for March 19th ( ABSI , ACXP , ADBE , AET , AHR , AMS , BDTX , BMEA , BOX , BP ) ",2025-03-19 18:00:00+00:00,https://www.wkrb13.com/2025/03/19/equities-research-analysts-updated-eps-estimates-for-march-19th-absi-acxp-adbe-aet-ahr-ams-bdtx-bmea-box-bp.html,United States,English,wkrb13.com
NVIDIA ( NASDAQ : NVDA ) Given Positive Rating at Susquehanna,2025-03-19 18:00:00+00:00,https://www.tickerreport.com/banking-finance/12881584/nvidia-nasdaqnvda-given-positive-rating-at-susquehanna.html,United States,English,tickerreport.com
Automotive Stocks To Watch Today – March 19th,2025-03-19 19:15:00+00:00,https://www.wkrb13.com/2025/03/19/automotive-stocks-to-watch-today-march-19th.html,United States,English,wkrb13.com
"Stocks , Dollar Rise Ahead Of Fed Meeting , Boeing Eyes Best Day In Nearly 2 Years : What Driving Markets Wednesday ? - Boeing ( NYSE : BA ) ",2025-03-19 19:30:00+00:00,https://www.benzinga.com/economics/macro-economic-events/25/03/44401960/stocks-dollar-rise-ahead-fed-meeting-boeing-eyes-best-day-nearly-2-years-whats-driving-markets-wednesday,United States,English,benzinga.com
Betting On Uber Driverless Future ? These ETFs Could Pay Off - Uber Technologies ( NYSE : UBER ) ,2025-03-19 19:30:00+00:00,https://www.benzinga.com/etfs/sector-etfs/25/03/44404071/betting-on-ubers-driverless-future-these-etfs-could-pay-off,United States,English,benzinga.com
Jensen Huang : AI Roadmap to Trillions & Why It Just the Beginning,2025-03-19 19:30:00+00:00,https://wallstreetpit.com/125287-jensen-huang-ais-roadmap-to-trillions-why-its-just-the-beginning/,United States,English,wallstreetpit.com
Humanoid robot revolution in less than 5 years ! ,2025-03-19 19:30:00+00:00,https://www.thedailystar.net/news/world/news/humanoid-robot-revolution-less-5-years-3852671,Bangladesh,English,thedailystar.net
Nvidia Chief Throws Shade at Broadcom Big Bets,2025-03-19 19:30:00+00:00,https://wallstreetpit.com/125296-nvidia-chief-throws-shade-at-broadcoms-big-bets/,United States,English,wallstreetpit.com
5 Things to Know Before the Stock Market Opens,2025-03-19 20:00:00+00:00,https://biztoc.com/x/b3c90bca5c5a04f2,,English,biztoc.com
5 Scientists in History Who Inspired the Names of Nvidia A . I . Chips,2025-03-19 20:00:00+00:00,https://biztoc.com/x/a958e8d33dc67a3e,,English,biztoc.com
"Nvidia Huang isnt shying away from DeepSeek , says AI needs 100x more computing power [ Video ] ",2025-03-19 20:00:00+00:00,https://www.aol.com/finance/nvidias-huang-isn-t-shying-192706547.html,United States,English,aol.com
What Going On With Stereotaxis Shares Wednesday ? ,2025-03-19 20:00:00+00:00,https://biztoc.com/x/9df9b5dddc59167e,,English,biztoc.com
Nasdaq continues leading market rally as Fed leaves rates unchanged,2025-03-19 20:15:00+00:00,https://www.proactiveinvestors.com/companies/news/1068149/nasdaq-continues-leading-market-rally-as-fed-leaves-rates-unchanged-1068149.html,United States,English,proactiveinvestors.com
Is NVIDIA ( NVDA ) the Top Stock to Buy According to Marshall Wace LLP ? ,2025-03-19 20:15:00+00:00,https://www.insidermonkey.com/blog/is-nvidia-nvda-the-top-stock-to-buy-according-to-marshall-wace-llp-1486009/,United States,English,insidermonkey.com
What Going On With Stereotaxis Shares Wednesday ? - Stereotaxis ( AMEX : STXS ) ,2025-03-19 21:00:00+00:00,https://www.benzinga.com/trading-ideas/movers/25/03/44404347/whats-going-on-with-stereotaxis-shares-wednesday,United States,English,benzinga.com
