title,seendate,url,sourcecountry,language,domain
1 Stock ( Not Nvidia ) Could Be a Massive Winner From Data Center AI,2024-05-12 18:45:00+00:00,https://www.fool.com/investing/2024/05/12/1-stock-not-nvidia-could-be-a-massive-winner-from/?source=iedfolrf0000001,United States,English,fool.com
Could Be a Massive Winner From Data Center AI,2024-05-12 19:45:00+00:00,https://biztoc.com/x/8ab5cbb4c1ab39c4,,English,biztoc.com
Analysts retune SoundHound AI stock price target after earnings,2024-05-12 20:00:00+00:00,https://www.wenatcheeworld.com/arena/finance/analysts-retune-soundhound-ai-stock-price-target-after-earnings/article_6cc6e6ec-20ec-50ed-9126-e1ab47e04884.html,United States,English,wenatcheeworld.com
Billionaire Ken Fisher Loves These 10 AI Stocks,2024-05-12 20:45:00+00:00,https://www.insidermonkey.com/blog/billionaire-ken-fisher-loves-these-10-ai-stocks-1301838/,United States,English,insidermonkey.com
Billionaire Ken Fisher Loves These 10 AI Stocks,2024-05-12 22:30:00+00:00,https://finance.yahoo.com/news/billionaire-ken-fisher-loves-10-200530508.html,United States,English,finance.yahoo.com
Magnificent 7 predicted to reinvest $350 billion this year,2024-05-12 23:15:00+00:00,https://seekingalpha.com/news/4104944-magnificent-7-predicted-to-reinvest-350-billion-this-year,United States,English,seekingalpha.com
10 lessons from earnings season - SocGen,2024-05-12 23:15:00+00:00,https://seekingalpha.com/news/4104941-10-lessons-from-earnings-season-socgen,United States,English,seekingalpha.com
"Nvidia Stock Has Another 50 % to Go , Says HSBC",2024-05-13 00:30:00+00:00,https://biztoc.com/x/13b564af3f8b4132,,English,biztoc.com
NVIDIA Accelerates Quantum Computing Centers Worldwide With,2024-05-13 06:45:00+00:00,https://www.globenewswire.com/news-release/2024/05/13/2880082/0/en/NVIDIA-Accelerates-Quantum-Computing-Centers-Worldwide-With-CUDA-Q-Platform.html,United States,English,globenewswire.com
NVIDIA Grace Hopper Ignites New Era of AI Supercomputing,2024-05-13 07:30:00+00:00,https://www.globenewswire.com/news-release/2024/05/13/2880081/0/en/NVIDIA-Grace-Hopper-Ignites-New-Era-of-AI-Supercomputing.html,United States,English,globenewswire.com
"Nvidia Is Leading the Artificial Intelligence ( AI ) Charge , But These 2 Companies Are Rising Stars",2024-05-13 09:45:00+00:00,https://biztoc.com/x/271615eb06ab7411,,English,biztoc.com
3 Ultra - Popular Stocks Billionaire Investors Are Selling,2024-05-13 10:00:00+00:00,https://finance.yahoo.com/news/3-ultra-popular-stocks-billionaire-090600137.html,United States,English,finance.yahoo.com
3 Ultra - Popular Stocks Billionaire Investors Are Selling,2024-05-13 10:15:00+00:00,https://www.fool.com/investing/2024/05/13/3-ultra-popular-stocks-billionaire-investors-sell/,United States,English,fool.com
Tentative trade across markets with DXY flat & modest gains in US equity futures ; NY Fed SCE due - Newsquawk US Market Open,2024-05-13 12:00:00+00:00,https://www.zerohedge.com/markets/tentative-trade-across-markets-dxy-flat-modest-gains-us-equity-futures-ny-fed-sce-due,United States,English,zerohedge.com
"Dow Jones Futures Rise ; Apple , Google Move On iPhone News ; Nvidia Gets Price Target Hike",2024-05-13 12:00:00+00:00,https://www.investors.com/market-trend/stock-market-today/dow-jones-futures-rise-apple-google-iphone-news-nvidia-price-target-hike/,United States,English,investors.com
Palantir : Isolated AI Benefits Arent Enough ( NYSE : PLTR ) ,2024-05-13 12:45:00+00:00,https://seekingalpha.com/article/4692569-palantir-isolated-ai-benefits-arent-enough,United States,English,seekingalpha.com
Futures Rise ; Five Magnificent Seven Stocks In Focus,2024-05-13 13:00:00+00:00,https://biztoc.com/x/d844849cf5ed645e,,English,biztoc.com
Monday big stocks to buy like Nvida,2024-05-13 13:15:00+00:00,https://www.cnbc.com/2024/05/13/mondays-big-stocks-to-buy-like-nvida.html,United States,English,cnbc.com
"Stocks making the biggest moves premarket : GME , NVDA , INTC , KVUE",2024-05-13 13:15:00+00:00,https://www.cnbc.com/2024/05/13/stocks-making-the-biggest-moves-premarket-gme-nvda-intc-kvue.html,United States,English,cnbc.com
Analysts overhaul Nvidia stock price targets ahead of earnings,2024-05-13 14:00:00+00:00,https://www.capjournal.com/arena/finance/analysts-overhaul-nvidia-stock-price-targets-ahead-of-earnings/article_e93d1b9a-1e5d-56bd-97c8-354561e8026d.html,United States,English,capjournal.com
Analysts overhaul Nvidia stock price targets ahead of earnings,2024-05-13 14:15:00+00:00,https://biztoc.com/x/20a4a454564d2519,,English,biztoc.com
Nvidia Was Key To Success In My Stock - Picking Derby,2024-05-13 14:30:00+00:00,https://www.forbes.com/sites/johndorfman/2024/05/13/nvidia-was-key-to-success-in-my-stock-picking-derby/,United States,English,forbes.com
Nvidia Seems Poised to Enter the Multibillion - Dollar Custom Artificial Intelligence ( AI ) Chip Market,2024-05-13 15:15:00+00:00,https://www.fool.com/investing/2024/05/13/nvda-stock-custom-ai-chip-asic-market/,United States,English,fool.com
Dow Jones Adds To Winning Streak ; GameStop Stock Soars | Investor Business Daily,2024-05-13 16:00:00+00:00,https://www.investors.com/market-trend/stock-market-today/dow-jones-sp500-nasdaq-gamestop-gme-stock/,United States,English,investors.com
Stock Market Today : Dow Jones Extends Win Streak ; Nvidia Stock Reverses Lower,2024-05-13 17:00:00+00:00,https://www.investors.com/market-trend/stock-market-today/dow-jones-sp500-nasdaq-nvidia-stock-nvda/,United States,English,investors.com
China asks tech companies to buy less of Nvidia chips,2024-05-13 17:45:00+00:00,https://invezz.com/news/2024/05/13/china-tech-companies-less-nvidia-chips/,United Kingdom,English,invezz.com
"Monday . com to Report Q1 Earnings : What in the Cards ? - Agilent Technologies ( NYSE : A ), Applied Mat ( NASDAQ : AMAT ) ",2024-05-13 18:15:00+00:00,https://www.benzinga.com/news/earnings/24/05/38787756/monday-com-to-report-q1-earnings-whats-in-the-cards,United States,English,benzinga.com
AMD Failed To Meet Lofty Expectations,2024-05-13 18:45:00+00:00,https://finance.yahoo.com/news/amd-failed-meet-lofty-expectations-180909619.html,United States,English,finance.yahoo.com
Pocket - Sized Powerhouses : 7 Small - Cap Value Stocks Ready to Roar,2024-05-13 21:15:00+00:00,https://biztoc.com/x/988d7889c2c44d93,,English,biztoc.com
What To Watch For As Big Investors Reveal Their Q1 Portfolio Bets This Week,2024-05-13 21:15:00+00:00,https://www.investopedia.com/big-investors-q1-investment-portfolios-13f-preview-8645809,United States,English,investopedia.com
"Stock Market Today : Stocks Chop Ahead of PPI , Powell Speech",2024-05-13 21:30:00+00:00,https://www.kiplinger.com/investing/stocks/stock-market-today-stocks-struggle-ahead-of-ppi-powell-speech,United States,English,kiplinger.com
Bonds and stocks chop to NY Fed & AI ahead of key risk events - Newsquawk US Market Wrap,2024-05-13 21:30:00+00:00,https://www.zerohedge.com/markets/bonds-and-stocks-chop-ny-fed-ai-ahead-key-risk-events-newsquawk-us-market-wrap,United States,English,zerohedge.com
It time to buy the AI dip in chip stocks : Jefferies,2024-05-13 21:45:00+00:00,https://www.streetinsider.com/AI/Its+time+to+buy+the+AI+dip+in+chip+stocks:+Jefferies/23211586.html,United States,English,streetinsider.com
Dow Jones Futures : Nvidia Buy Point ; GameStop Rockets 74 % On  Roaring Kitty  ,2024-05-13 22:00:00+00:00,https://www.investors.com/market-trend/stock-market-today/dow-jones-nvidia-stock-nvda-gme-stock/,United States,English,investors.com
AMD Failed To Meet Lofty Expectations,2024-05-13 22:15:00+00:00,https://biztoc.com/x/3d83a6f3d94a19c8,,English,biztoc.com
Where Will Nvidia Stock Be in 3 Years ? ,2024-05-14 02:00:00+00:00,https://biztoc.com/x/ea3e3220681317e1,,English,biztoc.com
Where Will Nvidia Stock Be in 3 Years ? | The Motley Fool,2024-05-14 02:15:00+00:00,https://www.fool.com/investing/2024/05/13/where-will-nvidia-stock-be-in-3-years/?source=iedfolrf0000001,United States,English,fool.com
US stocks lacked firm direction ahead of upcoming key events - Newsquawk Asia - Pac Market Open,2024-05-14 02:15:00+00:00,https://www.zerohedge.com/markets/us-stocks-lacked-firm-direction-ahead-upcoming-key-events-newsquawk-asia-pac-market-open,United States,English,zerohedge.com
7 Blue - Chip Stock Beauties to Bet on in May,2024-05-14 04:00:00+00:00,https://investorplace.com/market360/2024/05/7-blue-chip-stock-beauties-to-bet-on-in-may/,United States,English,investorplace.com
Goldman Sachs unveils startling S & P 500 prediction,2024-05-14 04:15:00+00:00,https://www.capjournal.com/arena/finance/goldman-sachs-unveils-startling-s-p-500-prediction/article_b36531fc-0840-55a7-8977-0715001d25e7.html,United States,English,capjournal.com
Where Will Nvidia Stock Be in 3 Years ? ,2024-05-14 07:00:00+00:00,https://biztoc.com/x/a028807dc6a93452,,English,biztoc.com
Goldman Sachs unveils startling S & P 500 prediction,2024-05-14 08:15:00+00:00,https://www.wenatcheeworld.com/arena/finance/goldman-sachs-unveils-startling-s-p-500-prediction/article_2f1a782d-3bf0-5fef-88c3-280bd352d02b.html,United States,English,wenatcheeworld.com
"Apple Biggest iPhone Assembler Posts 72 % Profit Surge Even As Revenue Takes Hit From Weaker Consumer Electronics Demand - Apple ( NASDAQ : AAPL ), Hon Hai Precision ( OTC : HNHPF ) ",2024-05-14 09:00:00+00:00,https://www.benzinga.com/news/earnings/24/05/38808250/apples-biggest-iphone-assembler-posts-72-profit-surge-even-as-revenue-takes-hit-from-weaker-consume,United States,English,benzinga.com
3 Nvidia Partners With Explosive Growth Potential to Buy Now,2024-05-14 09:00:00+00:00,https://www.fool.com/investing/2024/05/14/3-nvidia-partners-with-explosive-growth-potential/,United States,English,fool.com
Forget Nvidia : Billionaires Are Selling It and Piling Into 2 Rapidly Growing Artificial Intelligence ( AI ) Stocks Instead,2024-05-14 09:45:00+00:00,https://finance.yahoo.com/news/forget-nvidia-billionaires-selling-piling-092100969.html,United States,English,finance.yahoo.com
3 Nvidia Partners With Explosive Growth Potential to Buy Now,2024-05-14 10:15:00+00:00,https://biztoc.com/x/ca9ea312cc65612c,,English,biztoc.com
Where Will Nvidia Stock Be in 3 Years ? | The Motley Fool,2024-05-14 10:15:00+00:00,https://www.fool.com/investing/2024/05/13/where-will-nvidia-stock-be-in-3-years/,United States,English,fool.com
"  Overhyped : Billionaire Stanley Druckenmiller sold 30 % of his Nvidia stake , compares AI to 1999 internet boom  it went down 80 %. Why he not dumping it all though",2024-05-14 11:00:00+00:00,https://www.aol.com/finance/overhyped-billionaire-stanley-druckenmiller-sold-100500911.html,United States,English,aol.com
"Stanley Druckenmiller sold 30 % of his Nvidia stake , compares AI to internet boom why he not fully out yet",2024-05-14 11:00:00+00:00,https://finance.yahoo.com/news/stanley-druckenmiller-sold-30-nvidia-100500345.html,United States,English,finance.yahoo.com
Render Token To Experience Massive Price Action Next Week As Nvidia Is Set To Reveal Its Q1 Earnings ! ,2024-05-14 11:00:00+00:00,https://biztoc.com/x/883ea447ab9dffb4,,English,biztoc.com
Take It From Warren Buffett : Misses Are Inevitable,2024-05-14 12:30:00+00:00,https://www.morningstar.com/financial-advice/misses-are-inevitable,China,English,morningstar.com
Nvidia in focus as Wells Fargo ups price target on data center strength,2024-05-14 12:45:00+00:00,https://seekingalpha.com/news/4105730-nvidia-in-focus-as-wells-fargo-ups-price-target-on-data-center-strength,United States,English,seekingalpha.com
3 Reasons to Buy Nvidia Stock Before May 22 ( and 1 Reason to Sell ) ,2024-05-14 12:45:00+00:00,https://biztoc.com/x/55e52fccc698d13e,,English,biztoc.com
NVIDIA results to see earnings beat trend continue - analysts,2024-05-14 13:30:00+00:00,https://www.proactiveinvestors.co.uk/companies/news/1047512/nvidia-results-to-see-earnings-beat-trend-continue-analysts-1047512.html,United Kingdom,English,proactiveinvestors.co.uk
Quantum Leap : 3 Computing Stocks on the Brink of a Breakout,2024-05-14 13:45:00+00:00,https://investorplace.com/2024/05/quantum-leap-3-computing-stocks-on-the-brink-of-a-breakout/,United States,English,investorplace.com
Forget Nvidia : Billionaires Are Selling It and Piling Into 2 Rapidly Growing Artificial Intelligence ( AI ) Stocks Instead,2024-05-14 15:15:00+00:00,https://www.fool.com/investing/2024/05/14/forget-nvidia-billionaires-sell-and-buy-2-ai-stock/,United States,English,fool.com
"Market Clubhouse Morning Memo - May 14th , 2024 ( Trade Strategy For SPY , QQQ , AAPL , MSFT , NVDA , GOOGL , META And TSLA ) - Invesco QQQ Trust , Series 1 ( NASDAQ : QQQ ) ",2024-05-14 15:15:00+00:00,https://www.benzinga.com/markets/24/05/38818631/market-clubhouse-morning-memo-may-14th-2024-trade-strategy-for-spy-qqq-aapl-msft-nvda-googl-meta-and,United States,English,benzinga.com
Super Micro Computer Stock : Buy The Dip ( NASDAQ : SMCI ) ,2024-05-14 16:00:00+00:00,https://seekingalpha.com/article/4692999-super-micro-computer-buy-the-dip,United States,English,seekingalpha.com
Analysts Continue to Increase Nvidia Price Target Prior to Earnings,2024-05-14 17:00:00+00:00,https://www.fool.com/investing/2024/05/14/analysts-continue-to-increase-nvidias-price-target/?source=iedfolrf0000001,United States,English,fool.com
Renaissance Technologie Strategic Moves : A Deep Dive into NVIDIA Significant Reduction,2024-05-14 18:00:00+00:00,https://finance.yahoo.com/news/renaissance-technologies-strategic-moves-deep-170123949.html,United States,English,finance.yahoo.com
"Forget Nvidia : 2 Super Semiconductor Stocks to Buy Hand Over Fist , According to Certain Wall Street Analysts",2024-05-14 20:00:00+00:00,https://www.fool.com/investing/2024/05/14/forget-nvidia-2-super-semiconductor-stocks-to-buy/,United States,English,fool.com
3 Reasons to Buy Nvidia Stock Before May 22 ( and 1 Reason to Sell ) ,2024-05-14 20:00:00+00:00,https://www.fool.com/investing/2024/05/14/3-reasons-to-buy-nvidia-stock-before-may-22-and-1/,United States,English,fool.com
"Take - Two to Report Q4 Earnings : What in Store ? - Agilent Technologies ( NYSE : A ), Applied Mat ( NASDAQ : AMAT ) ",2024-05-14 20:00:00+00:00,https://www.benzinga.com/news/earnings/24/05/38815183/take-two-to-report-q4-earnings-whats-in-store,United States,English,benzinga.com
Dow Jones Futures : Stock Market Near Highs Ahead Of CPI Inflation ; GameStop Surges 60 % In Meme Mania,2024-05-14 21:30:00+00:00,https://www.investors.com/market-trend/stock-market-today/dow-jones-futures-cpi-inflation-gamestop-surges-60/,United States,English,investors.com
Blue - Chip Blues : 3 Stocks to Ditch Before They Drag You Down,2024-05-15 04:00:00+00:00,https://investorplace.com/2024/05/blue-chip-blues-3-stocks-to-ditch-before-they-drag-you-down/,United States,English,investorplace.com
Nvidia Stock Prediction : What Will Its Price Be in 2025 ? ,2024-05-15 08:45:00+00:00,https://biztoc.com/x/1e85f7bfedb8df68,,English,biztoc.com
Alphabet debuts beefed - up AI search and chatbot,2024-05-15 09:45:00+00:00,https://www.rte.ie/news/business/2024/0515/1449248-google-ai-announcements/,Ireland,English,rte.ie
Is AMD Stock a Buy Now ? Here What You Need to Know,2024-05-15 11:15:00+00:00,https://biztoc.com/x/ba2a1650b3c5fdff,,English,biztoc.com
Prediction : 2 Artificial Intelligence ( AI ) Stocks That Could Be Worth More Than Nvidia 5 Years From Now,2024-05-15 11:15:00+00:00,https://biztoc.com/x/4ac000fc95fde18d,,English,biztoc.com
U . S . senators push for $32B in emergency spending on AI,2024-05-15 12:15:00+00:00,https://seekingalpha.com/news/4106303-us-senators-push-for-32b-in-emergency-spending-on-ai,United States,English,seekingalpha.com
"US Inflation Falls As Expected In April , Bolsters Fed Rate Cut Bets - NVIDIA ( NASDAQ : NVDA ), Advanced Micro Devices ( NASDAQ : AMD ) ",2024-05-15 13:15:00+00:00,https://www.benzinga.com/markets/equities/24/05/38842603/us-inflation-falls-as-expected-in-april-bolsters-fed-rate-cut-bets,United States,English,benzinga.com
Stock Market Today : Dow Jones Rallies On CPI Inflation Data ; GME Stock Plunges 25 % ,2024-05-15 15:00:00+00:00,https://www.investors.com:443/market-trend/stock-market-today/dow-jones-sp500-nasdaq-cpi-gamestop-stock-gme/,United States,English,investors.com
Top 10 Holdings of Mormon Church $55 Billion Stock Portfolio : 1Q24,2024-05-15 15:00:00+00:00,https://markets.businessinsider.com/news/stocks/mormon-church-stock-portfolio-top-investments-holdings-ensign-peak-advisors-2024-5,United States,English,markets.businessinsider.com
"Nvidia Recently Bought 5 Artificial Intelligence ( AI ) Stocks , and 1 Is Absolutely Soaring",2024-05-15 15:15:00+00:00,https://www.fool.com/investing/2024/05/15/nvidia-recently-bought-5-ai-stocks-and-1-soaring/,United States,English,fool.com
The Best ASX Artificial Intelligence ( AI ) Shares,2024-05-15 15:30:00+00:00,https://thebull.com.au/best-asx-stocks/the-best-asx-artificial-intelligence-ai-shares/,Australia,English,thebull.com.au
Barlow Wealth Partners Inc . Makes New $3 . 73 Million Investment in NVIDIA Co . ( NASDAQ : NVDA ) ,2024-05-15 16:00:00+00:00,https://www.defenseworld.net/2024/05/15/barlow-wealth-partners-inc-makes-new-3-73-million-investment-in-nvidia-co-nasdaqnvda.html,Russia,English,defenseworld.net
Philippe Laffont Strategic Moves in Q1 2024 : A Deep Dive into NVIDIA Significant Reduction,2024-05-15 17:30:00+00:00,https://finance.yahoo.com/news/philippe-laffonts-strategic-moves-q1-170230125.html,United States,English,finance.yahoo.com
"How Apple , Nvidia , and Others Could Benefit From OpenAI New AI Model GPT - 4o",2024-05-15 20:30:00+00:00,https://www.investopedia.com/how-apple-nvidia-and-others-could-benefit-from-openai-new-ai-model-gpt-4o-8648151,United States,English,investopedia.com
"Paul Tudor Jones Adjusts Portfolio , Major Reduction in NVIDIA Amidst Strategic Shifts",2024-05-15 20:30:00+00:00,https://finance.yahoo.com/news/paul-tudor-jones-adjusts-portfolio-200123123.html,United States,English,finance.yahoo.com
STOCK MARKET SNAPSHOT FOR 16 / 05 / 2024 | Hellenic Shipping News Worldwide,2024-05-15 22:15:00+00:00,https://www.hellenicshippingnews.com/stock-market-snapshot-for-16-05-2024/,China,English,hellenicshippingnews.com
3 top ETFs that will give your investments a climate - friendly impact,2024-05-15 22:45:00+00:00,https://www.equities.com/impact-investing/3-top-etfs-that-will-give-your-investments-a-climate-friendly-impact/,United States,English,equities.com
"Dow Jones Futures : Dow , S & P 500 , Nasdaq Hit Highs , Nvidia Leads 12 New Buys ; What To Do Now",2024-05-15 23:00:00+00:00,https://www.investors.com:443/market-trend/stock-market-today/dow-jones-futures-sp-500-nasdaq-highs-nvidia-leads-new-buys/,United States,English,investors.com
Investors eye these 4 top - performing semiconductor stocks for quick returns,2024-05-15 23:45:00+00:00,https://invezz.com/news/2024/05/15/4-top-performing-semiconductor-stocks-for-quick-returns/,United Kingdom,English,invezz.com
Tudor Investment top buys and sells in Q1 ( NYSE : V ) ,2024-05-16 00:00:00+00:00,https://seekingalpha.com/news/4107057-tudor-investments-top-buys-and-sells-in-q1,United States,English,seekingalpha.com
2 Semiconductor Stocks to Buy and Hold for Great Long - Term Potential,2024-05-16 00:15:00+00:00,https://www.fool.ca/2024/05/15/2-semiconductor-stocks-to-buy-and-hold-for-great-long-term-potential/,Canada,English,fool.ca
Current Earnings Outlook Reflects Positivity,2024-05-16 01:00:00+00:00,https://finance.yahoo.com/news/current-earnings-outlook-reflects-positivity-230800139.html,United States,English,finance.yahoo.com
Joel Greenblatt Amplifies S & P 500 ETF Trust Holdings in Q1 2024,2024-05-16 02:15:00+00:00,https://finance.yahoo.com/news/joel-greenblatt-amplifies-p-500-011912898.html,United States,English,finance.yahoo.com
"Futures : Market Rally Hits Highs , Nvidia Leads 12 New Buys",2024-05-16 02:30:00+00:00,https://biztoc.com/x/d29e0fb22c36d56b,,English,biztoc.com
A better - than - expected CPI report cheers investors . ,2024-05-16 02:45:00+00:00,https://www.bendbulletin.com/business/finance/a-better-than-expected-cpi-report-cheers-investors/article_267f0d89-e378-58e1-997f-c4d758f299f7.html,United States,English,bendbulletin.com
The Best Jim Cramer Stock to Buy Now ? ,2024-05-16 03:15:00+00:00,https://biztoc.com/x/0cda34a62c7b1813,,English,biztoc.com
US close : Stocks higher following CPI reading,2024-05-16 03:30:00+00:00,https://www.sharecast.com/news/market-report-us-close/us-close-stocks-higher-following-cpi-reading--16788326.html,United Kingdom,English,sharecast.com
Wall Street Favorites : 3 Dividend Stocks With Strong Buy Ratings for May 2024,2024-05-16 03:30:00+00:00,https://investorplace.com/2024/05/wall-street-favorites-3-dividend-stocks-with-strong-buy-ratings-for-may-2024/,United States,English,investorplace.com
4 Reasons to Buy Nvidia Stock Before May 22,2024-05-16 03:30:00+00:00,https://biztoc.com/x/3b87a224ed712494,,English,biztoc.com
3 reasons to buy Nvidia stock before May 22 ( and 1 reason to sell ) ,2024-05-16 03:45:00+00:00,https://www.fool.com.au/2024/05/16/3-reasons-to-buy-nvidia-stock-before-may-22-and-1-reason-to-sell-usfeed/,Australia,English,fool.com.au
A better - than - expected CPI report cheers investors . ,2024-05-16 04:30:00+00:00,https://www.wenatcheeworld.com/arena/finance/a-better-than-expected-cpi-report-cheers-investors/article_c4379d9d-4d73-5cf0-928a-79867acee246.html,United States,English,wenatcheeworld.com
A better - than - expected CPI report cheers investors . ,2024-05-16 04:45:00+00:00,https://www.news-daily.com/arena/thestreet/a-better-than-expected-cpi-report-cheers-investors/article_7eb95470-93c4-555e-919d-fddde8a5cc5b.html,United States,English,news-daily.com
Nvidia Faces Macro Headwinds And Micro Tailwinds ( NASDAQ : NVDA ) ,2024-05-16 06:15:00+00:00,https://seekingalpha.com/article/4693623-nvidia-faces-macro-headwinds-and-micro-tailwinds,United States,English,seekingalpha.com
Analyst calls : All the market - moving Wall Street chatter from Thursday,2024-05-16 10:15:00+00:00,https://www.cnbc.com/2024/05/16/analyst-calls-all-the-market-moving-wall-street-chatter-from-thursday.html,United States,English,cnbc.com
Forget Nvidia : Here My Top Artificial Intelligence ( AI ) Stock to Buy Instead,2024-05-16 11:15:00+00:00,https://finance.yahoo.com/news/forget-nvidia-heres-top-artificial-101200239.html,United States,English,finance.yahoo.com
Nvidia Stock Next Big Catalysts Could Come on May 22 . Should You Buy Shares Before Then ? ,2024-05-16 14:00:00+00:00,https://www.fool.com/investing/2024/05/16/nvda-stock-earnings-ai-stocks-earnings/?source=iedfolrf0000001,United States,English,fool.com
Meet the Only 3  Magnificent Seven  Stocks Outperforming the Nasdaq Composite Over the Last 3 Months,2024-05-16 14:00:00+00:00,https://biztoc.com/x/5057a01be99f55e8,,English,biztoc.com
Forget Nvidia : Here My Top Artificial Intelligence ( AI ) Stock to Buy Instead,2024-05-16 14:00:00+00:00,https://www.fool.com/investing/2024/05/16/forget-nvidia-heres-my-top-artificial-intelligence/?source=iedfolrf0000001,United States,English,fool.com
Meet the Only 3  Magnificent Seven  Stocks Outperforming the Nasdaq Composite Over the Last 3 Months,2024-05-16 14:00:00+00:00,https://www.fool.com/investing/2024/05/16/magnificent-seven-stocks-outperform-nasdaq/?source=iedfolrf0000001,United States,English,fool.com
"1 Wall Street Analyst Thinks Nvidia Stock Is Going to $1 , 200 . Is It a Buy Around $945 ? ",2024-05-16 14:00:00+00:00,https://www.fool.com/investing/2024/05/16/1-wall-street-analyst-sees-nvidia-stock-at-1200/?source=iedfolrf0000001,United States,English,fool.com
Darwin Wealth Management LLC Cuts Stake in NVIDIA Co . ( NASDAQ : NVDA ) ,2024-05-16 14:30:00+00:00,https://www.defenseworld.net/2024/05/16/darwin-wealth-management-llc-cuts-stake-in-nvidia-co-nasdaqnvda.html,Russia,English,defenseworld.net
NVIDIA Co . ( NASDAQ : NVDA ) Stock Holdings Decreased by Discovery Value Fund,2024-05-16 14:30:00+00:00,https://www.defenseworld.net/2024/05/16/nvidia-co-nasdaqnvda-stock-holdings-decreased-by-discovery-value-fund.html,Russia,English,defenseworld.net
"Walmart Attracts Wealthier Consumers â€“ Stock Market Tell , Red Hot New Housing Slows - Walmart ( NYSE : WMT ) ",2024-05-16 16:15:00+00:00,https://www.benzinga.com/markets/24/05/38876943/walmart-attracts-wealthier-consumers-stock-market-tell-red-hot-new-housing-slows,United States,English,benzinga.com
AMD replaces Nvidia on Wolfe top stocks list,2024-05-16 17:15:00+00:00,https://biztoc.com/x/d515e341d813a7f4,,English,biztoc.com
"Dow rises to 40 , 000 for the first time : Live updates â€“ NBC4 Washington",2024-05-16 17:15:00+00:00,https://www.nbcwashington.com/news/business/money-report/stock-futures-are-little-changed-after-sp-500-closes-above-5300-for-the-first-time-live-updates/3617290/,United States,English,nbcwashington.com
NVDA Stock Alert : Northrop Grumman Locks Into Nvidia Deal,2024-05-16 18:00:00+00:00,https://biztoc.com/x/5a727cf0daa9dbd7,,English,biztoc.com
AI Play AMD Stock May Be Near Breakout | Investor Business Daily,2024-05-16 19:15:00+00:00,https://www.investors.com/news/technology/stocks-to-watch-advanced-micro-devices-sees-relative-strength-rating-jump-to-84/,United States,English,investors.com
"  Dont Expect Another Rally on May 22 , Says Piper Sandler About Nvidia Stock",2024-05-17 02:00:00+00:00,https://biztoc.com/x/e1c48da717ad3fdb,,English,biztoc.com
Bridgewater Associates boosts stake in AI heavyweight,2024-05-17 03:15:00+00:00,https://www.capjournal.com/arena/finance/bridgewater-associates-boosts-stake-in-ai-heavyweight/article_e5e8e393-18ab-549c-b9cb-8baa41a88ce4.html,United States,English,capjournal.com
Bridgewater Associates boosts stake in AI heavyweight,2024-05-17 03:15:00+00:00,https://www.bendbulletin.com/business/finance/bridgewater-associates-boosts-stake-in-ai-heavyweight/article_5b1faf65-053b-5f6b-8ebe-9403e97fb5ba.html,United States,English,bendbulletin.com
