title,seendate,url,sourcecountry,language,domain
APAC stocks were subdued following the somewhat indecisive performance on Wall St â€“ Newsquawk Europe Market Open,2024-05-21 07:45:00+00:00,https://www.zerohedge.com/markets/apac-stocks-were-subdued-following-somewhat-indecisive-performance-wall-st-newsquawk-europe,United States,English,zerohedge.com
"Fed Trader Talks TLT , Nvidia Bullishness , Tesla Bearishness , Bitcoin Neutrality",2024-05-21 11:30:00+00:00,https://seekingalpha.com/article/4694600-fed-trader-talks-tlt-nvidia-bullishness-tesla-bearishness-and-bitcoin-neutrality,United States,English,seekingalpha.com
Seth Klarman 2024 Portfolio : Top New Stock Picks,2024-05-21 12:15:00+00:00,https://www.insidermonkey.com/blog/seth-klarman-2024-portfolio-top-new-stock-picks-1304729/,United States,English,insidermonkey.com
"Baystreet . ca - Watch These Stocks Today : Zoom , ZIM Shipping , Microsoft , and More",2024-05-21 13:00:00+00:00,http://baystreet.ca/articles/stockstowatch/97683/Watch-These-Stocks-Today-Zoom-ZIM-Shipping-Microsoft-and-More,Canada,English,baystreet.ca
"ASML and Taiwan Semi Prep for Potential China - Taiwan Conflict with Remote Shutdown Feature - ASML Holding ( NASDAQ : ASML ), Taiwan Semiconductor ( NYSE : TSM ) ",2024-05-21 14:15:00+00:00,https://www.benzinga.com/government/24/05/38940907/asml-and-taiwan-semi-prep-for-potential-china-taiwan-conflict-with-remote-shutdown-feature,United States,English,benzinga.com
Stock - Split Watch : 5 Artificial Intelligence ( AI ) Stocks That Look Ready to Split,2024-05-21 14:45:00+00:00,https://www.fool.com/investing/2024/05/21/stock-split-watch-5-artificial-intelligence-ai-sto/,United States,English,fool.com
A chip stock hedge if the AI trend cools off a bit following Nvidia earnings,2024-05-21 15:00:00+00:00,https://www.cnbc.com/2024/05/21/a-chip-stock-hedge-if-the-ai-trend-cools-off-a-bit-following-nvidias-earnings.html,United States,English,cnbc.com
"19 , 150 Shares in NVIDIA Co . ( NASDAQ : NVDA ) Bought by Monolith Management Ltd",2024-05-21 15:00:00+00:00,https://www.defenseworld.net/2024/05/21/19150-shares-in-nvidia-co-nasdaqnvda-bought-by-monolith-management-ltd.html,Russia,English,defenseworld.net
"Market Clubhouse Morning Memo - May 21st , 2024 ( Trade Strategy For SPY , QQQ , AAPL , MSFT , NVDA , GOOGL , META And TSLA ) - Invesco QQQ Trust , Series 1 ( NASDAQ : QQQ ) ",2024-05-21 15:00:00+00:00,https://www.benzinga.com/markets/24/05/38942882/market-clubhouse-morning-memo-may-21st-2024-trade-strategy-for-spy-qqq-aapl-msft-nvda-googl-meta-and,United States,English,benzinga.com
"Wall Street Analysts Just Trimmed Price Target for D . R . Horton , Inc . ( NYSE : DHI ) ",2024-05-21 16:00:00+00:00,https://www.insidermonkey.com/blog/wall-street-analysts-just-trimmed-price-target-for-d-r-horton-inc-nysedhi-1304939/,United States,English,insidermonkey.com
Forget Nvidia : Billionaires Are Selling It and Buying These 2 Supercharged Artificial Intelligence ( AI ) Growth Stocks Instead,2024-05-21 16:45:00+00:00,https://www.fool.com/investing/2024/05/21/forget-nvidia-billionaires-sell-buy-supercharge-ai/,United States,English,fool.com
Why APA Corporation Stock Is A Bargain Now ( Rating Upgrade ) ( NASDAQ : APA ) ,2024-05-21 19:00:00+00:00,https://seekingalpha.com/article/4694778-why-apa-corporation-stock-is-a-bargain-now-rating-upgrade,United States,English,seekingalpha.com
Wall Street Analysts Just Trimmed Price Target for NICE Ltd . ( NASDAQ : NICE ) ,2024-05-21 19:15:00+00:00,https://www.insidermonkey.com/blog/wall-street-analysts-just-trimmed-price-target-for-nice-ltd-nasdaqnice-1304970/,United States,English,insidermonkey.com
Wall Street Analysts Just Trimmed Price Target for DXC Technology Company ( NYSE : DXC ) ,2024-05-21 19:15:00+00:00,https://www.insidermonkey.com/blog/wall-street-analysts-just-trimmed-price-target-for-dxc-technology-company-nysedxc-1304976/,United States,English,insidermonkey.com
NVIDIA Co . ( NASDAQ : NVDA ) Shares Purchased by Nordwand Advisors LLC,2024-05-21 19:45:00+00:00,https://www.defenseworld.net/2024/05/21/nvidia-co-nasdaqnvda-shares-purchased-by-nordwand-advisors-llc.html,Russia,English,defenseworld.net
"IBD Live Q & A And Two Key Stock Lists For May 21 , 2024",2024-05-21 20:15:00+00:00,https://www.investors.com/research/ibd-live-qa/ibd-live-qa-and-two-key-asasamay-2-1-2024/,United States,English,investors.com
3 Reasons NVIDIA Is About to Announce a Stock Split,2024-05-21 20:45:00+00:00,https://247wallst.com/investing/2024/05/21/3-reasons-nvidia-is-about-to-announce-a-stock-split/,United States,English,247wallst.com
ETF Industry KPI : 5 / 20 / 2024,2024-05-21 20:45:00+00:00,https://www.etftrends.com/etf-strategist-channel/etf-industry-kpi-5-20-2024/,China,English,etftrends.com
"As Advisors Underweight Large Cap Growth , Try FDG",2024-05-21 20:45:00+00:00,https://www.etftrends.com/core-strategies-channel/advisors-underweight-large-cap-growth-try-fdg/,China,English,etftrends.com
"Nasdaq , S & P 500 End Choppy Trading Day At New Record Closing Highs",2024-05-21 21:00:00+00:00,https://www.finanznachrichten.de/nachrichten-2024-05/62291104-nasdaq-s-p-500-end-choppy-trading-day-at-new-record-closing-highs-020.htm,Germany,English,finanznachrichten.de
"Stock Market Today : S & P 500 , Nasdaq in record close ahead of Nvidia earnings By Investing . com",2024-05-21 21:30:00+00:00,https://www.investing.com/news/stock-market-news/stock-market-today-sp-500-nasdaq-in-record-close-ahead-of-nvidia-earnings-3448993,United States,English,investing.com
NVDA Stock Alert : Amazon Halts Orders of Nvidia Superchip,2024-05-21 21:45:00+00:00,https://investorplace.com/2024/05/nvda-stock-alert-amazon-halts-orders-of-nvidia-superchip/,United States,English,investorplace.com
"Stock market today : Nasdaq , S & P pop to records as Wall Street waits for Nvidia earnings",2024-05-21 21:45:00+00:00,https://biztoc.com/x/670e70b3a4031b35,,English,biztoc.com
Why Nvidia Stock Is an Irreplaceable Juggernaut of the AI Era,2024-05-21 21:45:00+00:00,https://investorplace.com/market360/2024/05/why-nvidia-stock-is-an-irreplaceable-juggernaut-of-the-ai-era/,United States,English,investorplace.com
"Nasdaq , S & P 500 End Choppy Trading Day At New Record Closing Highs",2024-05-21 21:45:00+00:00,https://www.rttnews.com/3449294/nasdaq-s-p-500-end-choppy-trading-day-at-new-record-closing-highs.aspx,United States,English,rttnews.com
"S & P 500 , Nasdaq close at new highs as investors await Nvidia earnings",2024-05-21 22:30:00+00:00,https://www.proactiveinvestors.com/companies/news/1048063/s-p-500-nasdaq-close-at-new-highs-as-investors-await-nvidia-s-earnings-1048063.html,United States,English,proactiveinvestors.com
"Peloton , Bitcoin , Ethereum , PepsiCo , Tesla , XP Power , AstraZeneca , Nvidia â€“ Markets Defused",2024-05-21 22:30:00+00:00,https://www.proactiveinvestors.co.uk/companies/news/1048114/peloton-bitcoin-ethereum-pepsico-tesla-xp-power-astrazeneca-nvidia-markets-defused-1048114.html,United Kingdom,English,proactiveinvestors.co.uk
Baystreet . ca - Top Ways to Trade the Potential $25 Trillion Artificial Intelligence Opportunity,2024-05-21 22:45:00+00:00,http://baystreet.ca/stockstowatch/18020/Top-Ways-to-Trade-the-Potential-25-Trillion-Artificial-Intelligence-Opportunity,Canada,English,baystreet.ca
What You Need To Know Ahead of Nvidia Earnings Report,2024-05-21 23:45:00+00:00,https://www.investopedia.com/nvidia-q1-fy-2025-earnings-preview-8643286,United States,English,investopedia.com
4 Takeaways From Microsoft Build Developer Conference Keynote,2024-05-21 23:45:00+00:00,https://www.investopedia.com/4-takeaways-from-microsoft-build-developer-conference-keynote-2024-8651858,United States,English,investopedia.com
Stock Market News Today : Markets notch record closing high ahead of Nvidia results ( SP500 ) ,2024-05-22 00:15:00+00:00,https://seekingalpha.com/news/4108911-stock-market-news-today-nasdaq-sp500-dow-jones,United States,English,seekingalpha.com
"Dow Jones Futures : Nasdaq Hits High , Eli Lilly Breaks Out , But Here Comes Nvidia",2024-05-22 00:15:00+00:00,https://www.investors.com/market-trend/stock-market-today/dow-jones-futures-nasdaq-hits-high-eli-lilly-breaks-out-but-here-comes-nvidia/,United States,English,investors.com
"Dow Jones Futures : Nasdaq Hits High , Eli Lilly Breaks Out , But Here Comes Nvidia",2024-05-22 00:15:00+00:00,https://www.investors.com:443/market-trend/stock-market-today/dow-jones-futures-nasdaq-hits-high-eli-lilly-breaks-out-but-here-comes-nvidia/,United States,English,investors.com
Nvidia ends at record high ahead of earnings ; AWS confirms Hopper halt ( NASDAQ : NVDA ) ,2024-05-22 00:15:00+00:00,https://seekingalpha.com/news/4108792-nvidia-slips-amazon-web-services-confirms-hopper-halt-ahead-blackwell-launch,United States,English,seekingalpha.com
Here why Nvidia stock could sustain its stunning bull run after May 22,2024-05-22 01:15:00+00:00,https://www.fool.com.au/2024/05/22/heres-why-nvidia-stock-could-sustain-its-stunning-bull-run-after-may-22-usfeed/,Australia,English,fool.com.au
Goldman Sachs unveils favorite tech stocks after earnings reports,2024-05-22 01:30:00+00:00,https://biztoc.com/x/dda07c578e606eab,,English,biztoc.com
This industry is getting a boost from the AI race : Strategist,2024-05-22 01:30:00+00:00,https://biztoc.com/x/3204b0fc93ff489d,,English,biztoc.com
Goldman Sachs unveils favorite tech stocks after earnings reports,2024-05-22 02:15:00+00:00,https://www.wenatcheeworld.com/arena/finance/goldman-sachs-unveils-favorite-tech-stocks-after-earnings-reports/article_9d5cb087-379a-562f-9899-510c88797612.html,United States,English,wenatcheeworld.com
NVIDIA Earnings Shock : What Investors Need to Know Before the Big Reveal,2024-05-22 03:30:00+00:00,https://biztoc.com/x/653031e062a4089d,,English,biztoc.com
Futures : Two Titans Flash Buy Signals ; Nvidia Up Next,2024-05-22 03:30:00+00:00,https://biztoc.com/x/204283a9a5f4fd2c,,English,biztoc.com
AI Revolution Lifts Gas Pipeline Stocks,2024-05-22 04:45:00+00:00,https://biztoc.com/x/ed10c33d1bbe2caf,,English,biztoc.com
Forget Nvidia : This ASX growth stock is poised for its own bull run,2024-05-22 06:15:00+00:00,https://www.fool.com.au/2024/05/22/forget-nvidia-this-asx-growth-stock-is-poised-for-its-own-bull-run/,Australia,English,fool.com.au
"NVIDIA ( NASDAQ : NVDA ) PT Raised to $1 , 100 . 00 at Barclays",2024-05-22 07:15:00+00:00,https://www.dailypolitical.com/2024/05/21/nvidia-nasdaqnvda-pt-raised-to-1100-00-at-barclays.html,United States,English,dailypolitical.com
"  Big Short  Fame Investor Picks Nvidia And AMD As Most Obvious AI Investment Opportunities , But Thinks Apple Is  Hidden  Play - Apple ( NASDAQ : AAPL ), Advanced Micro Devices ( NASDAQ : AMD ) ",2024-05-22 08:00:00+00:00,https://www.benzinga.com/markets/equities/24/05/38956589/big-short-fame-investor-picks-nvidia-and-amd-as-most-obvious-ai-investment-opportunities-but-thi,United States,English,benzinga.com
Where on earth will Nvidia stock be in 1 year ? ,2024-05-22 09:45:00+00:00,https://www.fool.co.uk/2024/05/22/where-on-earth-will-nvidia-stock-be-in-1-year/,United Kingdom,English,fool.co.uk
"Nvidia earnings : Blackwell transition , 2 other questions ahead of report",2024-05-22 11:00:00+00:00,https://www.cnbc.com/2024/05/22/nvidia-earnings-blackwell-transition-2-other-questions-ahead-of-report.html,United States,English,cnbc.com
Worldwide Takeover : 3 Stocks Poised for Global Domination,2024-05-22 11:15:00+00:00,https://investorplace.com/2024/05/worldwide-takeover-3-stocks-poised-for-global-domination/,United States,English,investorplace.com
Can Nvidia Live Up To The Hype ? Analyst Says Q1 Earnings Anticipation  Like That Of A Taylor Swift Concert  As Wall Street Keeps Hopes Sky - High - NVIDIA ( NASDAQ : NVDA ) ,2024-05-22 11:30:00+00:00,https://www.benzinga.com/analyst-ratings/analyst-color/24/05/38958935/can-nvidia-live-up-to-the-hype-analyst-says-q1-earnings-anticipation-like-that-of-a,United States,English,benzinga.com
Eagle Bay Advisors LLC Sells 536 Shares of NVIDIA Co . ( NASDAQ : NVDA ) ,2024-05-22 13:15:00+00:00,https://www.defenseworld.net/2024/05/22/eagle-bay-advisors-llc-sells-536-shares-of-nvidia-co-nasdaqnvda.html,Russia,English,defenseworld.net
NVIDIA Co . ( NASDAQ : NVDA ) Stock Holdings Lifted by Lazard Freres Gestion S . A . S . ,2024-05-22 13:15:00+00:00,https://www.defenseworld.net/2024/05/22/nvidia-co-nasdaqnvda-stock-holdings-lifted-by-lazard-freres-gestion-s-a-s.html,Russia,English,defenseworld.net
"Thornburg Investment Management Inc . Sells 30 , 453 Shares of NVIDIA Co . ( NASDAQ : NVDA ) ",2024-05-22 13:15:00+00:00,https://www.defenseworld.net/2024/05/22/thornburg-investment-management-inc-sells-30453-shares-of-nvidia-co-nasdaqnvda.html,Russia,English,defenseworld.net
NVIDIA Co . ( NASDAQ : NVDA ) Shares Sold by KLR Investment Advisors LLC,2024-05-22 13:15:00+00:00,https://www.defenseworld.net/2024/05/22/nvidia-co-nasdaqnvda-shares-sold-by-klr-investment-advisors-llc.html,Russia,English,defenseworld.net
NVIDIA Co . ( NASDAQ : NVDA ) Shares Bought by Foundations Investment Advisors LLC,2024-05-22 13:15:00+00:00,https://www.defenseworld.net/2024/05/22/nvidia-co-nasdaqnvda-shares-bought-by-foundations-investment-advisors-llc.html,Russia,English,defenseworld.net
CCLA Investment Management Trims Stock Position in NVIDIA Co . ( NASDAQ : NVDA ) ,2024-05-22 13:15:00+00:00,https://www.defenseworld.net/2024/05/22/ccla-investment-management-trims-stock-position-in-nvidia-co-nasdaqnvda.html,Russia,English,defenseworld.net
5 Things to Know Before the Stock Market Opens,2024-05-22 13:45:00+00:00,https://www.investopedia.com/5-things-to-know-before-the-stock-market-opens-may-22-2024-8652045,United States,English,investopedia.com
"Netflix Stock Is Already Doing What Nvidia , Apple Are Attempting",2024-05-22 13:45:00+00:00,https://www.investors.com/research/breakout-stocks-technical-analysis/netflix-stock-apple-nvidia-stock/,United States,English,investors.com
U . S . Stocks May Give Back Ground In Early Trading,2024-05-22 14:00:00+00:00,https://www.rttnews.com/story.aspx?Id=3449554,United States,English,rttnews.com
Dow Jones Futures Fall As Target Tumbles ; Nvidia Looms Over Stock Market,2024-05-22 14:00:00+00:00,https://www.investors.com/market-trend/stock-market-today/dow-jones-futures-target-but-here-comes-nvidia/,United States,English,investors.com
"Futures Drop , Yields Jump On Red - Hot united kingdom Inflation , Nvidia Earnings On Deck",2024-05-22 14:00:00+00:00,https://www.zerohedge.com/markets/futures-drop-yields-jump-red-hot-uk-inflation-nvidia-earnings-deck,United States,English,zerohedge.com
From The Viewpoint Of Calamity,2024-05-22 14:30:00+00:00,https://www.zerohedge.com/news/2024-05-22/viewpoint-calamity,United States,English,zerohedge.com
Nvidia to release earnings as AI demand continues unabated,2024-05-22 15:45:00+00:00,https://www.theglobeandmail.com/business/technology/article-nvidia-to-release-earnings-as-ai-demand-continues-unabated/,Canada,English,theglobeandmail.com
"AI Startup Scale Secures $1B From Investors Including AMD , Amazon & Meta , Doubling Valuation To $13 . 8B - ",2024-05-22 15:45:00+00:00,https://biztoc.com/x/517bc36b1b96a54e,,English,biztoc.com
"U . S . Stocks Little Changed Ahead Of Nvidia Earnings , Fed Minutes",2024-05-22 15:45:00+00:00,https://www.finanznachrichten.de/nachrichten-2024-05/62300382-u-s-stocks-little-changed-ahead-of-nvidia-earnings-fed-minutes-020.htm,Germany,English,finanznachrichten.de
CFRA Just Raised Its Price Target on Nvidia ( NVDA ) Stock,2024-05-22 15:45:00+00:00,https://biztoc.com/x/87d7756069d681ad,,English,biztoc.com
Nvidia share price is down ahead of earnings,2024-05-22 16:45:00+00:00,https://qz.com/nvidia-share-price-first-quarter-earnings-blackwell-1851493512,United States,English,qz.com
Stock Market News Today : Markets flat as investors await Nvidia results ( SP500 ) ,2024-05-22 17:00:00+00:00,https://seekingalpha.com/news/4109424-stock-market-news-today-nasdaq-sp500-dow-jones,United States,English,seekingalpha.com
Nvidia upcoming earnings has investors attention : See what SA analysts have to say,2024-05-22 17:00:00+00:00,https://seekingalpha.com/news/4109292-nvidias-upcoming-earnings-has-investors-attention-see-what-sa-analysts-have-to-say,United States,English,seekingalpha.com
Make Or Break Moment For AI Frenzy Ahead,2024-05-22 17:15:00+00:00,https://biztoc.com/x/86b3bb21880cb23f,,English,biztoc.com
A Hidden Gem Retailer With 20 % Upside,2024-05-22 17:15:00+00:00,https://biztoc.com/x/20c5b93914e54e1e,,English,biztoc.com
Listen to the NVIDIA ( NVDA ) Q1 2025 earnings call here,2024-05-22 17:30:00+00:00,https://www.shacknews.com/article/139958/listen-to-nvidia-nvda-q1-2025-earnings-call,United States,English,shacknews.com
Stock market today : Stocks take leg lower after Fed minutes with Nvidia earnings on deck,2024-05-22 19:30:00+00:00,https://biztoc.com/x/ba6837696a85d02a,,English,biztoc.com
All Eyes on Nvidia,2024-05-22 21:00:00+00:00,https://biztoc.com/x/5b0349adb77c7d9e,,English,biztoc.com
"Artificial Intelligence ( AI ) Cryptos Fetch . AI ( FET ), Render ( RNDR ), Bittensor ( TAO ) Gain in Price Ahead of Nvidia ( NVDA ) Earnings",2024-05-22 21:00:00+00:00,https://www.coindesk.com/markets/2024/05/22/ai-focused-tokens-edge-higher-ahead-of-nvidia-earnings-results/,United States,English,coindesk.com
The Nvidia Rivals : 3 AI Stocks Ready to Steal the Spotlight,2024-05-22 21:00:00+00:00,https://investorplace.com/2024/05/the-nvidia-rivals-3-ai-stocks-ready-to-steal-the-spotlight/,United States,English,investorplace.com
"Nvidia Stock Earnings Preview : Sorry , Q1 Will Be as Good as It Gets for NVDA . ",2024-05-22 21:00:00+00:00,https://investorplace.com/2024/05/nvidia-stock-earnings-preview-sorry-q1-will-be-as-good-as-it-gets-for-nvda/,United States,English,investorplace.com
CFRA Just Raised Its Price Target on Nvidia ( NVDA ) Stock,2024-05-22 21:00:00+00:00,https://investorplace.com/2024/05/cfra-just-raised-its-price-target-on-nvidia-nvda-stock/,United States,English,investorplace.com
U . S . Stocks Climb Off Worst Levels But Remain In The Red After Fed Minutes,2024-05-22 21:00:00+00:00,https://www.finanznachrichten.de/nachrichten-2024-05/62302549-u-s-stocks-climb-off-worst-levels-but-remain-in-the-red-after-fed-minutes-020.htm,Germany,English,finanznachrichten.de
Nvidia Q1 earnings push NVDA stock to new all - time high,2024-05-22 21:15:00+00:00,https://www.fxstreet.com/news/nvidia-q1-earnings-push-nvda-stock-to-new-all-time-high-202405222040,China,English,fxstreet.com
NVIDIA Corporation Bottom Line Climbs In Q1,2024-05-22 21:15:00+00:00,https://www.finanznachrichten.de/nachrichten-2024-05/62302720-nvidia-corporation-bottom-line-climbs-in-q1-020.htm,Germany,English,finanznachrichten.de
U . S . Stocks Climb Off Worst Levels But Remain In The Red After Fed Minutes,2024-05-22 21:15:00+00:00,https://www.rttnews.com/story.aspx?Id=3449626,United States,English,rttnews.com
"Nvidia ( NASDAQ : NVDA ) Delivers Strong Q1 Numbers , Guides For Strong Sales Next Quarter",2024-05-22 21:30:00+00:00,https://finance.yahoo.com/news/nvidia-nasdaq-nvda-delivers-strong-202426755.html,United States,English,finance.yahoo.com
"Nvidia Explodes Higher After Blowing Away Estimates , Guiding Sharply Higher , Unveils 10 : 1 Stock Split",2024-05-22 21:45:00+00:00,https://www.zerohedge.com/markets/nvidia-explodes-higher-after-blowing-away-estimates-guiding-sharply-higher-unveils-101,United States,English,zerohedge.com
"Nvidia reports $26 billion Q1 revenue , AI crypto tokens show correlative gains",2024-05-22 21:45:00+00:00,https://biztoc.com/x/0884d789df85982f,,English,biztoc.com
"Retail Earnings Reports , Nvidia Market Impact , and Strategic Investment Insights",2024-05-22 22:00:00+00:00,https://moneymorning.com/2024/05/22/three-things-moving-the-markets-today/,United States,English,moneymorning.com
18 Best AI Business Ideas in 2024 - Insider Monkey,2024-05-22 22:00:00+00:00,https://www.insidermonkey.com/blog/18-best-ai-business-ideas-in-2024-1300139/,United States,English,insidermonkey.com
The AI Arms Race Heats Up Ahead of Nvidia Earnings,2024-05-22 22:00:00+00:00,https://www.pymnts.com/news/2024/the-ai-arms-race-heats-up-ahead-of-nvidia-earnings/,United States,English,pymnts.com
"NVIDIA ( NASDAQ : NVDA ) Announces Quarterly Earnings Results , Beats Estimates By $0 . 98 EPS",2024-05-22 22:00:00+00:00,https://www.dailypolitical.com/2024/05/22/nvidia-nasdaqnvda-announces-quarterly-earnings-results-beats-estimates-by-0-98-eps.html,United States,English,dailypolitical.com
Nvidia incredibly pricey shares are about to get much cheaper,2024-05-22 22:00:00+00:00,https://edition.cnn.com/2024/05/22/business/nvidias-stock-split-earnings-results/,United States,English,edition.cnn.com
Nvidia incredibly pricey shares are about to get much cheaper,2024-05-22 22:15:00+00:00,https://www.wicz.com/story/50819846/nvidias-incredibly-pricey-shares-are-about-to-get-much-cheaper,United States,English,wicz.com
AMD Stock Is Rising Wednesday After The Bell : What Going On ? - Advanced Micro Devices ( NASDAQ : AMD ) ,2024-05-22 22:15:00+00:00,https://www.benzinga.com/news/earnings/24/05/38975102/amd-stock-is-rising-wednesday-after-the-bell-whats-going-on,United States,English,benzinga.com
Stocks Pressured from Higher Bond Yields - The Globe and Mail,2024-05-22 22:15:00+00:00,https://www.theglobeandmail.com/investing/markets/commodities/BTU22/pressreleases/26378871/stocks-pressured-from-higher-bond-yields/,Canada,English,theglobeandmail.com
After Nvidia : 4 Artificial Intelligence ( AI ) Stocks That Look Ready to Split,2024-05-22 22:30:00+00:00,https://www.fool.ca/2024/05/22/stock-split-watch-5-artificial-intelligence-ai-sto/,Canada,English,fool.ca
"NVIDIA tops high earnings expectations , announces 10 - for - 1 stock split",2024-05-22 22:30:00+00:00,https://www.proactiveinvestors.co.uk/companies/news/1048229/nvidia-tops-high-earnings-expectations-announces-10-for-1-stock-split-1048229.html,United Kingdom,English,proactiveinvestors.co.uk
Dow falls back from highs with Nvidia earnings on deck,2024-05-22 22:30:00+00:00,https://www.proactiveinvestors.com/companies/news/1048181/dow-falls-back-from-highs-with-nvidia-earnings-on-deck-1048181.html,United States,English,proactiveinvestors.com
What Next for Atrium Mortgage and its 8 % Dividend Yield ? ,2024-05-22 22:30:00+00:00,https://www.fool.ca/2024/05/22/whats-next-for-atrium-mortgage-and-its-8-dividend-yield/,Canada,English,fool.ca
"Dow Jones Futures : Nvidia Earnings Boom , CEO Jensen Huang Hails  Next Industrial Revolution ; AI Plays Rally",2024-05-22 22:30:00+00:00,https://www.investors.com:443/market-trend/stock-market-today/dow-jones-futures-nvidia-earnings-nvda-stock/,United States,English,investors.com
"Dow Jones Futures : Nvidia Earnings Boom , CEO Jensen Huang Hails  Next Industrial Revolution ; AI Plays Rally",2024-05-22 22:30:00+00:00,https://www.investors.com/market-trend/stock-market-today/dow-jones-futures-nvidia-earnings-nvda-stock/,United States,English,investors.com
NVIDIA ( NVDA ) Q1 2025 earnings results beat revenue & EPS expectations,2024-05-22 22:30:00+00:00,https://www.shacknews.com/article/139964/nvidia-nvda-q1-2025-earnings-results,United States,English,shacknews.com
NVIDIA ( NVDA ) forecasts Q2 2025 revenue above analyst estimates,2024-05-22 22:30:00+00:00,https://www.shacknews.com/article/139967/nvidia-nvda-q2-2025-revenue-forecast,United States,English,shacknews.com
Nvidia stock to split 10 - for - 1 as revenue more than triples in Q1,2024-05-22 22:30:00+00:00,https://invezz.com/news/2024/05/22/nvidia-q1-earnings-report/,United Kingdom,English,invezz.com
"NVIDIA ( NVDA ) announces a 10 - to - 1 stock split , increases dividend",2024-05-22 22:30:00+00:00,https://www.shacknews.com/article/139966/nvidia-nvda-q1-2025-stock-split,United States,English,shacknews.com
Nvidia Earnings Top Expectations As Sales Soar Amid Booming AI Demand,2024-05-22 22:45:00+00:00,https://www.investopedia.com/nvidia-q1-fy-2025-earnings-8652629,United States,English,investopedia.com
"Top Stock Movers Now : Target , Lululemon , TJX , and More",2024-05-22 22:45:00+00:00,https://www.investopedia.com/top-stock-movers-now-target-lululemon-tjx-and-more-8652368,United States,English,investopedia.com
How an Earnings - Fueled Move in Nvidia Stock Price Could Affect the Broader Market,2024-05-22 22:45:00+00:00,https://www.investopedia.com/how-an-earnings-fueled-move-in-nvidia-stock-price-could-affect-the-broader-market-8652271,United States,English,investopedia.com
"US Investors Gravitating to ETFs Over Single Stocks , Mutual Funds",2024-05-22 22:45:00+00:00,https://www.investopedia.com/u-s-investors-gravitating-to-etfs-over-single-stocks-mutual-funds-8652491,United States,English,investopedia.com
Futures : Will Nvidia Provide Catalyst For AI - Led Rally ? ,2024-05-22 22:45:00+00:00,https://biztoc.com/x/393a3e6b89b8e117,,English,biztoc.com
NVDA Earnings : Nvidia Jumps after Stellar Q1 Performance,2024-05-22 22:45:00+00:00,https://biztoc.com/x/2ee3bd127dbb3554,,English,biztoc.com
Stan Druckenmiller Sold NVIDIA And Bought This Undervalued ETF,2024-05-22 22:45:00+00:00,https://www.chiangraitimes.com/tech/stan-druckenmiller-sold-nvidia/,Thailand,English,chiangraitimes.com
US stocks finished lower as markets braced for Nvidia earnings although futures received a boost after - hours after the Co . results topped forecasts and announced a 10 - for - 1 stock split - Newsquawk Asia - Pac Market Open,2024-05-22 23:00:00+00:00,https://www.zerohedge.com/markets/us-stocks-finished-lower-markets-braced-nvidia-earnings-although-futures-received-boost,United States,English,zerohedge.com
NVIDIA Announces Financial Results for First Quarter Fiscal 2025,2024-05-22 23:00:00+00:00,https://nvidianews.nvidia.com/news/nvidia-announces-financial-results-for-first-quarter-fiscal-2025,United States,English,nvidianews.nvidia.com
