title,seendate,url,sourcecountry,language,domain
U . S . Stocks Finish Volatile Session Sharply Higher,2025-03-01 00:00:00+00:00,https://www.rttnews.com/story.aspx?Id=3517759,United States,English,rttnews.com
A Stock Market Rotation Is Underway . Will It Last ? ,2025-03-01 00:15:00+00:00,https://www.morningstar.com/markets/stock-market-rotation-is-underway-will-it-last,China,English,morningstar.com
Stock Market Today : Stocks Recover From Trump - Zelensky Slide,2025-03-01 00:30:00+00:00,https://www.kiplinger.com/investing/stocks/stock-market-today-stocks-recover-from-trump-zelensky-slide,United States,English,kiplinger.com
"Stock market today : Dow , S & P 500 , Nasdaq rally to cap volatile week , losing month",2025-03-01 00:45:00+00:00,https://finance.yahoo.com/news/live/stock-market-today-dow-sp-500-nasdaq-rally-to-cap-volatile-week-losing-month-143154388.html,United States,English,finance.yahoo.com
"Nvidia stock sinks over 8 %, market cap dips below $3T as earnings are no match for sky - high expectations",2025-03-01 01:15:00+00:00,https://finance.yahoo.com/news/nvidia-stock-sinks-over-8-market-cap-dips-below-3t-as-earnings-are-no-match-for-sky-high-expectations-194622325.html,United States,English,finance.yahoo.com
"  Sit This One Out , Says Investor About Nvidia Stock",2025-03-01 02:30:00+00:00,https://biztoc.com/x/98408a7ad4e68405,,English,biztoc.com
"US close : Bargain - hunting drives late rally , as stocks surge",2025-03-01 02:45:00+00:00,https://www.sharecast.com/news/market-report-us-close/us-close-bargain-hunting-drives-late-rally-as-stocks-surge--19063064.html,United Kingdom,English,sharecast.com
Jim Cramer on NVIDIA Corporation ( NVDA ):  There Are People Who Think It Dramatically Overvalued . And I Dont Get That  ,2025-03-01 09:45:00+00:00,https://www.insidermonkey.com/blog/jim-cramer-on-nvidia-corporation-nvda-there-are-people-who-think-its-dramatically-overvalued-and-i-dont-get-that-1468333/,United States,English,insidermonkey.com
Should You Buy Nvidia Now -- or Wait Until March 18 ? ,2025-03-01 11:45:00+00:00,https://biztoc.com/x/77693bbe02cd8d35,,English,biztoc.com
Super Micro faces nearly 30 % weekly loss amid growing AI server rivalry,2025-03-01 12:00:00+00:00,https://news.az/news/super-micro-faces-nearly-30-weekly-loss-amid-growing-ai-server-rivalry,Azerbaijan,English,news.az
Cutting Zelensky Down To Size,2025-03-01 12:15:00+00:00,https://www.zerohedge.com/news/2025-02-28/cutting-zelensky-down-size,United States,English,zerohedge.com
"Billionaires Sell Nvidia Stock and Buy a BlackRock ETF Wall Street Experts Say May Soar Up to 15 , 375 % ",2025-03-01 12:45:00+00:00,https://www.fool.com/investing/2025/03/01/billionaires-sell-nvidia-stock-buy-etf-soar-15375/,United States,English,fool.com
ARK Invest Cathie Wood : Nvidia is still a high - growth stock,2025-03-01 14:45:00+00:00,https://biztoc.com/x/66edb792922834a4,,English,biztoc.com
Bulls vs . Bears : Nvidia Q4 divides SA analysts ( NVDA : NASDAQ ) ,2025-03-01 16:45:00+00:00,https://seekingalpha.com/news/4415887-bulls-vs-bears-nvidia-q4-divides-sa-analysts,United States,English,seekingalpha.com
Beyond GPUs : Why Intel CPU Play Still Matters in AI,2025-03-01 17:15:00+00:00,https://wallstreetpit.com/124612-beyond-gpus-why-intels-cpu-play-still-matters-in-ai/,United States,English,wallstreetpit.com
"Investing Action Plan : Tariffs , Payrolls , Cybersecurity And A Super Bowl Betting Update",2025-03-01 18:00:00+00:00,https://www.investors.com/research/investing-action-plan/investing-action-plan-tariffs-payrolls-cybersecurity-and-a-super-bowl-betting-update/,United States,English,investors.com
Best Automotive Stocks To Watch Now – March 1st,2025-03-01 19:30:00+00:00,https://theenterpriseleader.com/2025/03/01/best-automotive-stocks-to-watch-now-march-1st.html,United States,English,theenterpriseleader.com
Promising Metaverse Stocks To Research – March 1st,2025-03-01 20:00:00+00:00,https://theenterpriseleader.com/2025/03/01/promising-metaverse-stocks-to-research-march-1st.html,United States,English,theenterpriseleader.com
This Artificial Intelligence ( AI ) Stock Has Delivered Bigger Gains Than Nvidia . It Could Soar Another 77 %. ,2025-03-01 21:15:00+00:00,https://www.fool.com/investing/2025/03/01/this-artificial-intelligence-ai-stock-has-delivere/?source=iedfolrf0000001,United States,English,fool.com
"Investing Action Plan : Tariffs , Payrolls , Cybersecurity And A Super Bowl Betting Update",2025-03-01 22:30:00+00:00,https://www.investors.com:443/research/investing-action-plan/investing-action-plan-tariffs-payrolls-cybersecurity-and-a-super-bowl-betting-update/,United States,English,investors.com
NVIDIA ( NASDAQ : NVDA ) Shares Down 2 . 9 % – What Next ? ,2025-03-01 23:00:00+00:00,https://theenterpriseleader.com/2025/03/01/nvidia-nasdaqnvda-shares-down-2-9-whats-next.html,United States,English,theenterpriseleader.com
NVIDIA ( NVDA ) Overweight Rating Reiterated at Cantor Fitzgerald,2025-03-02 11:15:00+00:00,https://theenterpriseleader.com/2025/03/02/nvidias-nvda-overweight-rating-reiterated-at-cantor-fitzgerald.html,United States,English,theenterpriseleader.com
"Nvidia Continues to See Unstoppable Growth , but Is the Stock Still a Buy ? ",2025-03-02 12:00:00+00:00,https://www.fool.com/investing/2025/03/02/nvidia-unstoppable-growth-stock-buy/?source=iedfolrf0000001,United States,English,fool.com
Billionaire Chase Coleman Has 43 % of His Portfolio in These 5 Unstoppable Artificial Intelligence ( AI ) Stocks,2025-03-02 12:00:00+00:00,https://www.fool.com/investing/2025/03/02/billionaire-chase-coleman-has-43-of-his-portfolio/?source=iedfolrf0000001,United States,English,fool.com
2 AI Chip Stocks to Buy in March | The Motley Fool,2025-03-02 12:00:00+00:00,https://www.fool.com/investing/2025/03/02/2-ai-chip-stocks-to-buy-in-march/?referring_guid=7b3579e1-7b97-4e2a-b5ac-75e5ed6fcd6f,United States,English,fool.com
What Next for Nvidia ? Jensen Huang Just Revealed 3 Reasons to Buy the Stock Hand Over Fist . ,2025-03-02 12:00:00+00:00,https://www.fool.com/investing/2025/03/02/whats-next-for-nvidia-jensen-huang-just-revealed-4/?source=iedfolrf0000001,United States,English,fool.com
Stocks To Watch in March And What to Watch For,2025-03-02 12:30:00+00:00,https://www.investopedia.com/stocks-to-watch-march-2025-nvda-tsla-tgt-pltr-app-vst-len-11688432,United States,English,investopedia.com
The dust settles on Nvidia : Morning Brief,2025-03-02 12:30:00+00:00,https://biztoc.com/x/466c915ae06f2130,,English,biztoc.com
"Nvidia Continues to See Unstoppable Growth , but Is the Stock Still a Buy ? ",2025-03-02 12:30:00+00:00,https://biztoc.com/x/51057be2229cb895,,English,biztoc.com
Valley National Advisers Inc . Increases Stock Position in NVIDIA Co . ( NASDAQ : NVDA ) ,2025-03-02 12:45:00+00:00,https://www.etfdailynews.com/2025/03/02/valley-national-advisers-inc-increases-stock-position-in-nvidia-co-nasdaqnvda/,United States,English,etfdailynews.com
NVIDIA Co . ( NASDAQ : NVDA ) Stock Holdings Lifted by Stock Yards Bank & Trust Co . ,2025-03-02 12:45:00+00:00,https://www.etfdailynews.com/2025/03/02/nvidia-co-nasdaqnvda-stock-holdings-lifted-by-stock-yards-bank-trust-co/,United States,English,etfdailynews.com
NVIDIA Co . ( NASDAQ : NVDA ) Stock Position Lessened by CFM Wealth Partners LLC,2025-03-02 12:45:00+00:00,https://www.etfdailynews.com/2025/03/02/nvidia-co-nasdaqnvda-stock-position-lessened-by-cfm-wealth-partners-llc/,United States,English,etfdailynews.com
S . A . Mason LLC Has $11 . 38 Million Stock Holdings in NVIDIA Co . ( NASDAQ : NVDA ) ,2025-03-02 12:45:00+00:00,https://www.etfdailynews.com/2025/03/02/s-a-mason-llc-has-11-38-million-stock-holdings-in-nvidia-co-nasdaqnvda/,United States,English,etfdailynews.com
Is Nvidia Stock a Buy Now ? | The Motley Fool,2025-03-02 14:15:00+00:00,https://www.fool.com/investing/2025/03/02/is-nvidia-stock-a-buy-now/?source=iedfolrf0000001,United States,English,fool.com
DeepSeek Crushed Constellation Energy . Is This Nuclear Stock a Buy Now ? ,2025-03-02 14:15:00+00:00,https://www.fool.com/investing/2025/03/02/deepseek-crushed-constellation-is-it-a-buy-now/?source=iedfolrf0000001,United States,English,fool.com
The market riskiest way to trade on the biggest tech stocks is not well understood by investors,2025-03-02 15:00:00+00:00,https://www.nbcdfw.com/news/business/money-report/the-markets-riskiest-way-to-trade-on-the-biggest-tech-stocks-is-not-well-understood-by-investors/3781448/,United States,English,nbcdfw.com
Family Investment Center Inc . Cuts Position in NVIDIA Co . ( NASDAQ : NVDA ) ,2025-03-02 15:15:00+00:00,https://www.etfdailynews.com/2025/03/02/family-investment-center-inc-cuts-position-in-nvidia-co-nasdaqnvda/,United States,English,etfdailynews.com
"Panoramic Investment Advisors LLC Acquires 2 , 875 Shares of NVIDIA Co . ( NASDAQ : NVDA ) ",2025-03-02 15:15:00+00:00,https://www.defenseworld.net/2025/03/02/panoramic-investment-advisors-llc-acquires-2875-shares-of-nvidia-co-nasdaqnvda.html,Russia,English,defenseworld.net
Willis Investment Counsel Boosts Stake in NVIDIA Co . ( NASDAQ : NVDA ) ,2025-03-02 15:15:00+00:00,https://www.defenseworld.net/2025/03/02/willis-investment-counsel-boosts-stake-in-nvidia-co-nasdaqnvda.html,Russia,English,defenseworld.net
NVIDIA Co . ( NASDAQ : NVDA ) Shares Sold by Deepwater Asset Management LLC,2025-03-02 15:15:00+00:00,https://www.defenseworld.net/2025/03/02/nvidia-co-nasdaqnvda-shares-sold-by-deepwater-asset-management-llc.html,Russia,English,defenseworld.net
JB Capital LLC Has $8 . 20 Million Holdings in NVIDIA Co . ( NASDAQ : NVDA ) ,2025-03-02 15:15:00+00:00,https://www.defenseworld.net/2025/03/02/jb-capital-llc-has-8-20-million-holdings-in-nvidia-co-nasdaqnvda.html,Russia,English,defenseworld.net
NVIDIA Co . ( NASDAQ : NVDA ) Shares Purchased by Willis Investment Counsel,2025-03-02 15:15:00+00:00,https://www.etfdailynews.com/2025/03/02/nvidia-co-nasdaqnvda-shares-purchased-by-willis-investment-counsel/,United States,English,etfdailynews.com
"Chicago Capital LLC Sells 4 , 463 Shares of NVIDIA Co . ( NASDAQ : NVDA ) ",2025-03-02 15:15:00+00:00,https://www.defenseworld.net/2025/03/02/chicago-capital-llc-sells-4463-shares-of-nvidia-co-nasdaqnvda.html,Russia,English,defenseworld.net
Deepwater Asset Management LLC Has $15 . 81 Million Stock Holdings in NVIDIA Co . ( NASDAQ : NVDA ) ,2025-03-02 15:15:00+00:00,https://www.etfdailynews.com/2025/03/02/deepwater-asset-management-llc-has-15-81-million-stock-holdings-in-nvidia-co-nasdaqnvda/,United States,English,etfdailynews.com
NVIDIA Co . ( NASDAQ : NVDA ) is Means Investment CO . Inc . 8th Largest Position,2025-03-02 15:15:00+00:00,https://www.etfdailynews.com/2025/03/02/nvidia-co-nasdaqnvda-is-means-investment-co-inc-s-8th-largest-position/,United States,English,etfdailynews.com
Princeton Global Asset Management LLC Boosts Stock Holdings in NVIDIA Co . ( NASDAQ : NVDA ) ,2025-03-02 15:15:00+00:00,https://www.etfdailynews.com/2025/03/02/princeton-global-asset-management-llc-boosts-stock-holdings-in-nvidia-co-nasdaqnvda/,United States,English,etfdailynews.com
NVIDIA Co . ( NASDAQ : NVDA ) Shares Bought by Princeton Global Asset Management LLC,2025-03-02 15:15:00+00:00,https://www.defenseworld.net/2025/03/02/nvidia-co-nasdaqnvda-shares-bought-by-princeton-global-asset-management-llc.html,Russia,English,defenseworld.net
"Financial Partners Group Inc Purchases 1 , 540 Shares of NVIDIA Co . ( NASDAQ : NVDA ) ",2025-03-02 15:15:00+00:00,https://www.defenseworld.net/2025/03/02/financial-partners-group-inc-purchases-1540-shares-of-nvidia-co-nasdaqnvda.html,Russia,English,defenseworld.net
NVIDIA Co . ( NASDAQ : NVDA ) Shares Acquired by Financial Partners Group Inc,2025-03-02 15:15:00+00:00,https://www.etfdailynews.com/2025/03/02/nvidia-co-nasdaqnvda-shares-acquired-by-financial-partners-group-inc/,United States,English,etfdailynews.com
Cook Wealth LLC Sells 279 Shares of NVIDIA Co . ( NASDAQ : NVDA ) ,2025-03-02 15:15:00+00:00,https://www.defenseworld.net/2025/03/02/cook-wealth-llc-sells-279-shares-of-nvidia-co-nasdaqnvda.html,Russia,English,defenseworld.net
NVIDIA Co . ( NASDAQ : NVDA ) Shares Purchased by Lynch Asset Management Inc . ,2025-03-02 15:15:00+00:00,https://www.defenseworld.net/2025/03/02/nvidia-co-nasdaqnvda-shares-purchased-by-lynch-asset-management-inc.html,Russia,English,defenseworld.net
"Jobs report , crucial retail earnings kick off March trading for investors : What to know this week",2025-03-02 16:30:00+00:00,https://finance.yahoo.com/news/jobs-report-crucial-retail-earnings-kick-off-march-trading-for-investors-what-to-know-this-week-123426431.html,United States,English,finance.yahoo.com
Nvidia post - earnings slide highlights key risk,2025-03-02 17:30:00+00:00,https://biztoc.com/x/746ac3f683f958fb,,English,biztoc.com
"Nvidia Risk - Reward Proposition Is Much Less Favorable , According to 1 Wall Street Analyst",2025-03-02 17:45:00+00:00,https://finance.yahoo.com/news/nvidias-risk-reward-proposition-much-170000957.html,United States,English,finance.yahoo.com
Best Metaverse Stocks To Add to Your Watchlist – March 2nd,2025-03-02 19:30:00+00:00,https://www.dailypolitical.com/2025/03/02/best-metaverse-stocks-to-add-to-your-watchlist-march-2nd.html,United States,English,dailypolitical.com
Nvidia Stock Finds Support from Friday Dip - Buyers,2025-03-02 20:15:00+00:00,https://www.investopedia.com/nvidia-stock-finds-support-from-friday-dip-buyers-11688344,United States,English,investopedia.com
Best Large Cap Stocks To Keep An Eye On – March 2nd,2025-03-02 22:00:00+00:00,https://theenterpriseleader.com/2025/03/02/best-large-cap-stocks-to-keep-an-eye-on-march-2nd.html,United States,English,theenterpriseleader.com
"Nasdaq Jumps 300 Points As Nvidia , Tesla Stocks Surge : Investor Sentiment Improves , But Greed Index Remains In  Extreme Fear  Zone - California Resources ( NYSE : CRC ), Nomad Foods ( NYSE : NOMD ) ",2025-03-03 06:30:00+00:00,https://www.benzinga.com/news/earnings/25/03/44069254/nasdaq-jumps-300-points-as-nvidia-tesla-stocks-surge-investor-sentiment-improves-but-greed-index-re,United States,English,benzinga.com
Bitcoin up by a fifth after Trump lists reserve tokens,2025-03-03 07:15:00+00:00,https://dunyanews.tv/en/Business/871148-bitcoin-up-by-a-fifth-after-trump-lists-reserve-tokens,Pakistan,English,dunyanews.tv
"Nvidia stock price will jump more than 50 % as the chipmaker remains in a  dominant position , BofA says",2025-03-03 07:45:00+00:00,https://finance.yahoo.com/news/nvidia-stock-price-jump-more-193928090.html,United States,English,finance.yahoo.com
What Analysts Think of Broadcom Stock Ahead of Earnings,2025-03-03 07:45:00+00:00,https://finance.yahoo.com/news/analysts-think-broadcom-stock-ahead-195652551.html,United States,English,finance.yahoo.com
"Nasdaq Jumps 300 Points As Nvidia , Tesla Stocks Surge : Investor Sentiment Improves , But Greed Index Remains In  Extreme Fear  Zone - California Resources ( NYSE : CRC ), Nomad Foods ( NYSE : NOMD ) ",2025-03-03 08:00:00+00:00,https://www.benzinga.com/news/earnings/25/03/44069254/nasdaq-jumps-300-points-as-nvidia-tesla-stocks-surge-investor-sentiment-improves-but-greed-index-remains-in-extreme-fear-zone,United States,English,benzinga.com
Nvidia Stock Plunges After Q4 Earnings  Beat : Possibly Start Of Bear Trend,2025-03-03 10:00:00+00:00,https://biztoc.com/x/4328e0762a3981e7,,English,biztoc.com
"Ming - Chi Kuo Dismisses Nvidia Order Cut Speculation Amid Intact AI Demand , Confirms TSMC Expansion On Track",2025-03-03 10:00:00+00:00,https://biztoc.com/x/09735bb4a28a0393,,English,biztoc.com
Watch the NVDA Stock Price  Map  ,2025-03-03 10:30:00+00:00,https://www.forexlive.com/stock-market-update/watch-the-nvda-stock-price-map-20250303/,Greece,English,forexlive.com
"Nvidia Earnings Roared Higher to Record Levels . So , Why Isnt the Stock Soaring ? ",2025-03-03 11:45:00+00:00,https://finance.yahoo.com/news/nvidias-earnings-roared-higher-record-233000884.html,United States,English,finance.yahoo.com
Markets Brief : The Risk of Stocks Priced for Perfection,2025-03-03 12:00:00+00:00,https://www.morningstar.com/markets/markets-brief-risk-stocks-priced-perfection,China,English,morningstar.com
"US Stocks Likely To Open Higher As Wall Street Watches TruTariff Talks :  March , April , May Tend To Be Solid Months In Post - Election Years , Says Expert - Invesco QQQ Trust , Series 1 ( NASDAQ : QQQ ), SPDR S & P 500 ( ARCA : SPY ) ",2025-03-03 13:15:00+00:00,https://www.benzinga.com/25/03/44071957/us-stock-likely-to-open-higher-amid-tariff-uncertainty-march-april-may-tend-to-be-solid-months-in-post-election-y,United States,English,benzinga.com
The Smartest Growth Stock to Buy With $500 Right Now,2025-03-03 13:45:00+00:00,https://www.fool.com/investing/2025/03/03/the-smartest-growth-stock-to-buy-with-500-right-no/?source=iedfolrf0000001,United States,English,fool.com
3 No - Brainer Artificial Intelligence ( AI ) Stocks to Buy With $200 Right Now,2025-03-03 13:45:00+00:00,https://www.fool.com/investing/2025/03/03/3-no-brainer-artificial-intelligence-ai-stocks-to/?source=iedfolrf0000001,United States,English,fool.com
Prediction : 3 Stocks Thatll Be Worth More Than Apple 5 Years From Now,2025-03-03 13:45:00+00:00,https://www.fool.com/investing/2025/03/03/prediction-3-stocks-thatll-be-worth-more-than-appl/?source=iedfolrf0000001,United States,English,fool.com
Technology Stocks To Follow Now – March 2nd,2025-03-03 14:00:00+00:00,https://www.wkrb13.com/2025/03/03/technology-stocks-to-follow-now-march-2nd.html,United States,English,wkrb13.com
Best Metaverse Stocks To Add to Your Watchlist – March 2nd,2025-03-03 14:00:00+00:00,https://www.themarketsdaily.com/2025/03/03/best-metaverse-stocks-to-add-to-your-watchlist-march-2nd.html,United States,English,themarketsdaily.com
Best Metaverse Stocks To Add to Your Watchlist – March 2nd,2025-03-03 14:00:00+00:00,https://www.modernreaders.com/news/2025/03/03/best-metaverse-stocks-to-add-to-your-watchlist-march-2nd.html,United States,English,modernreaders.com
Nvidia Passes Its Latest Test . Here What It Means for Investors . ,2025-03-03 14:00:00+00:00,https://www.fool.com/investing/2025/03/03/nvidia-passes-its-latest-test-heres-what-it-means/,United States,English,fool.com
What Nvidia market valuation says about where the stock will be in 5 years< !-- -- >,2025-03-03 14:15:00+00:00,https://www.marketwatch.com/story/what-nvidias-market-valuation-says-about-where-the-stock-will-be-in-5-years-5645b904,United States,English,marketwatch.com
What Nvidia market valuation says about where the stock will be in 5 years< !-- -- >,2025-03-03 14:15:00+00:00,https://www.marketwatch.com/story/what-nvidias-market-valuation-says-about-where-the-stock-will-be-in-5-years-5645b904?g=51ef56e4-814c-4e7f-a074-e8bc9896d75e&mod=mw_rss_bulletins,United States,English,marketwatch.com
Three AI stocks to play if you want to look past the Nvidia hardware build - out,2025-03-03 14:15:00+00:00,https://www.marketwatch.com/story/three-ai-stocks-to-play-if-you-want-to-look-past-the-nvidia-hardware-build-out-d13d4a22,United States,English,marketwatch.com
Nvidia Passes Its Latest Test . Here What It Means for Investors . ,2025-03-03 14:15:00+00:00,https://finance.yahoo.com/news/nvidia-passes-latest-test-heres-123500305.html,United States,English,finance.yahoo.com
Monday biggest Wall Street analyst calls,2025-03-03 14:15:00+00:00,https://www.cnbc.com/2025/03/03/mondays-biggest-wall-street-analyst-calls.html,United States,English,cnbc.com
"Why US Stock Futures Are Rising Today - Invesco QQQ Trust , Series 1 ( NASDAQ : QQQ ), SPDR S & P 500 ( ARCA : SPY ) ",2025-03-03 15:00:00+00:00,https://www.benzinga.com/analyst-ratings/analyst-color/25/03/44071957/us-stocks-likely-to-open-higher-as-wall-street-watches-trutariff-talks-march-april-may-tend-to-be-solid-months-in-post-election-years-says-expert,United States,English,benzinga.com
Singapore Investigates Potential Fraud In Nvidia AI Chip Shipments :  The Question Is Whether Malaysia Was A Final Destination  ,2025-03-03 15:15:00+00:00,https://biztoc.com/x/970f3b8317af11b5,,English,biztoc.com
Futures Rebound As Powerful Short Squeeze Kicks In,2025-03-03 15:30:00+00:00,https://www.zerohedge.com/market-recaps/futures-rebound-short-short-squeeze-kicks,United States,English,zerohedge.com
Nvidia Stock : Nvidia Falls As Trump Curbs Face This ChallengeInvestor Business Daily,2025-03-03 15:45:00+00:00,https://www.investors.com/research/nvidia-stock-buy-now-march-2025/,United States,English,investors.com
In - Depth Analysis : NVIDIA Versus Competitors In Semiconductors & Semiconductor Equipment Industry,2025-03-03 16:00:00+00:00,https://biztoc.com/x/bfd6546ce79e525a,,English,biztoc.com
"Nvidia Stock Slides Monday , Extending Post - Earnings Selloff",2025-03-03 17:00:00+00:00,https://finance.yahoo.com/news/nvidia-stock-slides-monday-extending-155906807.html,United States,English,finance.yahoo.com
Nvidia Passes Its Latest Test . Here What It Means for Investors,2025-03-03 17:30:00+00:00,https://biztoc.com/x/2f688d248bcef44d,,English,biztoc.com
3 AI Stocks to Buy Before They Steal Nvidia Crown,2025-03-03 17:30:00+00:00,https://investorplace.com/smartmoney/2025/03/3-ai-stocks-to-buy-before-they-steal-nvidias-crown/,United States,English,investorplace.com
"Stock market today : Dow , S & P 500 , Nasdaq slide as Trump tariffs stalk markets",2025-03-03 17:45:00+00:00,https://finance.yahoo.com/news/live/stock-market-today-dow-sp-500-nasdaq-slide-as-trump-tariffs-stalk-markets-170207980.html,United States,English,finance.yahoo.com
"Tesla , Crypto Exchanges May Lead Early Upward Move On Wall Street",2025-03-03 17:45:00+00:00,https://www.rttnews.com/3518077/tesla-crypto-exchanges-may-lead-early-upward-move-on-wall-street.aspx,United States,English,rttnews.com
Nvidia or Broadcom could help Intel turn its business around,2025-03-03 17:45:00+00:00,https://qz.com/intel-18a-process-ai-chips-nvidia-broadcom-tsmc-amd-1851767324,United States,English,qz.com
U . S . stocks give up early gains after poor factory report,2025-03-03 17:45:00+00:00,https://qz.com/u-s-stocks-trump-tariffs-poor-manufacturing-1851767349,United States,English,qz.com
Nvidia stock drops as new China chip smuggling report raises investor fears on further export scrutiny,2025-03-03 17:45:00+00:00,https://finance.yahoo.com/news/nvidia-stock-drops-as-new-china-chip-smuggling-report-raises-investor-fears-on-further-export-scrutiny-164735316.html,United States,English,finance.yahoo.com
Why Nvidia ( NVDA ) Stock Is Sinking Today,2025-03-03 18:45:00+00:00,https://www.insidermonkey.com/blog/why-nvidia-nvda-stock-is-sinking-today-1470298/,United States,English,insidermonkey.com
"Stock market today : Dow , S & P 500 , Nasdaq losses accelerate as Trump forges ahead on tariffs",2025-03-03 20:45:00+00:00,https://finance.yahoo.com/news/live/stock-market-today-dow-sp-500-nasdaq-losses-accelerate-as-trump-forges-ahead-on-tariffs-170207739.html,United States,English,finance.yahoo.com
Dow tumbles 800 points as Trump confirms tariffs on Mexico and Canada will start Tuesday,2025-03-03 21:15:00+00:00,https://us.cnn.com/2025/03/03/investing/us-stocks-tariffs-loom/,United States,English,us.cnn.com
"Meta Stock , Netflix Test These Upper Limits As Tesla Exits | Investor Business Daily",2025-03-03 21:15:00+00:00,https://www.investors.com/research/how-to-find-the-best-stocks-to-buy/meta-stock-netflix-test-these-upper-limits-as-tesla-exits-scene/,United States,English,investors.com
NVIDIA Corporation ( NVDA ) Surpasses Expectations with Strong AI Demand and Blackwell Sales,2025-03-03 21:15:00+00:00,https://www.insidermonkey.com/blog/nvidia-corporation-nvda-surpasses-expectations-with-strong-ai-demand-and-blackwell-sales-1470423/,United States,English,insidermonkey.com
Nebius Group N . V . ( NBIS ):  A Big Money Loser – Period . End of Story  Says Jim Cramer ! ,2025-03-03 21:15:00+00:00,https://www.insidermonkey.com/blog/nebius-group-n-v-nbis-a-big-money-loser-period-end-of-story-says-jim-cramer-1470222/,United States,English,insidermonkey.com
Nvidia gets swept up in a wave of uncertainty hitting Wall Street . Here is what going on,2025-03-03 21:15:00+00:00,https://www.cnbc.com/2025/03/03/nvidia-gets-swept-up-in-a-wave-of-uncertainty-hitting-wall-street-here-is-whats-going-on.html,United States,English,cnbc.com
"Nvidia sells off 7 % after Singapore investigates Blackwell fraud , market awaits Trump tariff news",2025-03-03 21:30:00+00:00,https://www.fxstreet.com/news/nvidia-sells-off-7-after-singapore-investigates-blackwell-fraud-market-awaits-trump-tariff-news-202503031927,China,English,fxstreet.com
Promising Large Cap Stocks To Add to Your Watchlist – March 3rd,2025-03-03 21:30:00+00:00,https://www.wkrb13.com/2025/03/03/promising-large-cap-stocks-to-add-to-your-watchlist-march-3rd.html,United States,English,wkrb13.com
Dow tumbles 800 points as Trump confirms tariffs on Mexico and Canada will start Tuesday,2025-03-03 21:30:00+00:00,https://www.erienewsnow.com/story/52490699/dow-tumbles-800-points-as-trump-confirms-tariffs-on-mexico-and-canada-will-start-tuesday,United States,English,erienewsnow.com
Dow Jones tumbles as tariff threat cycle starts again,2025-03-03 21:30:00+00:00,https://www.fxstreet.com/news/dow-jones-industrial-average-little-changed-as-investors-await-news-on-tariffs-202503031806,China,English,fxstreet.com
GraniteShares 2x Long NVDA Daily ETF ( NASDAQ : NVDL ) Shares Gap Down – Time to Sell ? ,2025-03-03 21:30:00+00:00,https://www.dailypolitical.com/2025/03/03/graniteshares-2x-long-nvda-daily-etf-nasdaqnvdl-shares-gap-down-time-to-sell.html,United States,English,dailypolitical.com
GraniteShares 2x Long NVDA Daily ETF ( NASDAQ : NVDL ) Shares Gap Down – What Next ? ,2025-03-03 21:30:00+00:00,https://www.tickerreport.com/banking-finance/12859696/graniteshares-2x-long-nvda-daily-etf-nasdaqnvdl-shares-gap-down-whats-next.html,United States,English,tickerreport.com
