title,seendate,url,sourcecountry,language,domain
Ant Group Taps Chinese Chips to Cut AI Training Costs by 20 % ,2025-03-24 11:00:00+00:00,http://www.econotimes.com/Ant-Group-Taps-Chinese-Chips-to-Cut-AI-Training-Costs-by-20-1705522,United States,English,econotimes.com
"FuriosaAI Rejects $800M Meta Takeover , Aims to Rival NVIDIA in AI Chip Race",2025-03-24 11:00:00+00:00,http://www.econotimes.com/FuriosaAI-Rejects-800M-Meta-Takeover-Aims-to-Rival-NVIDIA-in-AI-Chip-Race-1705530,United States,English,econotimes.com
Why Buying Nvidia Stock on the Dip Is Probably Smart -- and Buying Palantir Stock Probably Isnt,2025-03-24 11:30:00+00:00,https://www.fool.com/investing/2025/03/24/why-buying-nvidia-stock-on-the-dip-palantir/,United States,English,fool.com
Nvidia Is Down 23 % From Its Peak . Here How the Rest of 2025 Could Play Out for This Artificial Intelligence ( AI ) Powerhouse . ,2025-03-24 13:30:00+00:00,https://finance.yahoo.com/news/nvidia-down-23-peak-heres-124500661.html,United States,English,finance.yahoo.com
NVIDIA Corporation ( NVDA ): Guinness Global Innovator Top Performing Stock,2025-03-24 13:30:00+00:00,https://www.insidermonkey.com/blog/nvidia-corporation-nvda-guinness-global-innovators-top-performing-stock-1490733/,United States,English,insidermonkey.com
"Dow Jones Futures Jump 400 Points On Trump Tariff News ; Nvidia , Tesla Rally",2025-03-24 13:45:00+00:00,https://biztoc.com/x/a7a2409962bfd394,,English,biztoc.com
Should You Forget Rigetti Computing and Buy This Millionaire - Maker Stock Instead ? ,2025-03-24 14:00:00+00:00,https://www.fool.com/investing/2025/03/24/should-you-forget-rigetti-computing-and-buy-this-m/?source=iedfolrf0000001,United States,English,fool.com
"Stock market today : Dow , S & P 500 , Nasdaq jump amid hopes Trump will soften next tariff blow",2025-03-24 14:15:00+00:00,https://finance.yahoo.com/news/live/stock-market-today-dow-sp-500-nasdaq-jump-amid-hopes-trump-will-soften-next-tariff-blow-133040523.html,United States,English,finance.yahoo.com
The mechanics behind the Nvidia stock sell - off,2025-03-24 14:15:00+00:00,https://finance.yahoo.com/news/the-mechanics-behind-the-nvidia-stock-sell-off-131750075.html,United States,English,finance.yahoo.com
"Billionaire Stanley Druckenmiller Jettisoned Shares of Palantir and Nvidia , and Is Piling Into 3 High - Profile Turnaround Stocks",2025-03-24 15:30:00+00:00,https://www.fool.com/investing/2025/03/24/billionaire-stanley-druckenmiller-sell-pltr-nvidia/,United States,English,fool.com
Nvidia Is Down 23 % From Its Peak . Here How the Rest of 2025 Could Play Out for This Artificial Intelligence ( AI ) Powerhouse . ,2025-03-24 15:30:00+00:00,https://www.fool.com/investing/2025/03/24/nvidia-is-down-23-from-its-peak-heres-how-the-rest/,United States,English,fool.com
Jim Cramer says investors should get away from this idea as stocks rally to start the week,2025-03-24 17:00:00+00:00,https://www.cnbc.com/2025/03/24/jim-cramer-says-investors-should-get-away-from-this-idea-as-stocks-rally-to-start-the-week.html,United States,English,cnbc.com
NVIDIA ( NASDAQ : NVDA ) Shares Up 3 . 6 % – Time to Buy ? ,2025-03-24 17:30:00+00:00,https://www.modernreaders.com/news/2025/03/24/nvidia-nasdaqnvda-shares-up-3-6-time-to-buy.html,United States,English,modernreaders.com
"Deploy Cash And Reduce Hedges , Powerful Market Mechanics And Trump Tariffs Control The Stock Market",2025-03-24 19:45:00+00:00,https://www.benzinga.com/markets/equities/25/03/44460994/deploy-cash-and-reduce-hedges-powerful-market-mechanics-and-trump-tariffs-control-the-stock-mark,United States,English,benzinga.com
"Stock market today : Dow , S & P 500 , Nasdaq soar on hopes Trump may dial back next tariff wave",2025-03-24 20:30:00+00:00,https://finance.yahoo.com/news/live/stock-market-today-dow-sp-500-nasdaq-soar-on-hopes-trump-may-dial-back-next-tariff-wave-200101412.html,United States,English,finance.yahoo.com
NVIDIA ( NVDA ) Breaks Barriers with Advanced AI Networking,2025-03-24 20:30:00+00:00,https://www.insidermonkey.com/blog/nvidia-nvda-breaks-barriers-with-advanced-ai-networking-1490270/,United States,English,insidermonkey.com
Tesla vs . Nvidia : Certain Wall Street Analysts Say Buy 1 Stock But Are Split on the Other,2025-03-24 20:45:00+00:00,https://finance.yahoo.com/news/tesla-vs-nvidia-certain-wall-113000841.html,United States,English,finance.yahoo.com
iShares Global Tech ETF ( IXN ): Among The Best Global ETFs To Buy,2025-03-24 21:00:00+00:00,https://www.insidermonkey.com/blog/ishares-global-tech-etf-ixn-among-the-best-global-etfs-to-buy-1491016/,United States,English,insidermonkey.com
Nvidia Stock Rises As Chipmakers Gain An Easing Trade Concerns : What Going On ? ,2025-03-24 22:00:00+00:00,https://biztoc.com/x/a08bae6a81b0e188,,English,biztoc.com
Stocks jump as Trump flags possible moderation on tariffs,2025-03-24 22:30:00+00:00,https://qz.com/stocks-surge-trump-tariffs-trade-war-byd-tesla-1851772012,United States,English,qz.com
Is NVIDIA Corporation ( NASDAQ : NVDA ) The Best Extremely Profitable Stocks to Buy According to Analyst ? ,2025-03-25 00:00:00+00:00,https://www.insidermonkey.com/blog/is-nvidia-corporation-nasdaqnvda-the-best-extremely-profitable-stocks-to-buy-according-to-analyst-1491681/,United States,English,insidermonkey.com
"Dow Jumps Nearly 600 Points As Recession Fears Ease , Tesla Rallies 12 %: Greed Index Moves To  Fear  Zone - Core & Main ( NYSE : CNM ), GameStop ( NYSE : GME ) ",2025-03-25 07:45:00+00:00,https://www.benzinga.com/25/03/44468629/dow-jumps-around-600-points-as-recession-fears-ease-investor-fear-eases-fear-greed-index-moves-to-fear-zone,United States,English,benzinga.com
"Samsung Electronics co - CEO dies , leaving new appointee in charge",2025-03-25 08:15:00+00:00,https://www.abc.net.au/news/2025-03-25/samsung-electronics-co-ceo-dies-of-cardiac-arrest/105094660,Australia,English,abc.net.au
"Before You Rush to Buy Nvidia , Here Are 3 Artificial Intelligence ( AI ) Stocks You Cant Afford to Ignore",2025-03-25 09:30:00+00:00,https://www.fool.com/investing/2025/03/25/before-you-rush-to-buy-nvidia-here-are-3-artificia/?source=iedfolrf0000001,United States,English,fool.com
Nvidia Stock Just Did This for the First Time in 3 Years . Here What History Says Will Happen Next,2025-03-25 09:30:00+00:00,https://www.fool.com/investing/2025/03/25/nvidia-just-did-this-for-first-time-in-3-years/?source=iedfolrf0000001,United States,English,fool.com
1 Super Semiconductor Stock ( Besides Nvidia or AMD ) to Buy Hand Over Fist for the Artificial Intelligence ( AI ) Revolution,2025-03-25 09:30:00+00:00,https://www.fool.com/investing/2025/03/25/1-semiconductor-stock-nvidia-buy-hand-over-fist-ai/?source=iedfolrf0000001,United States,English,fool.com
AI Datacenter Bubble ? Alibaba Tsai Raises Red Flags Amid Soaring Investments,2025-03-25 10:30:00+00:00,http://www.econotimes.com/AI-Datacenter-Bubble-Alibabas-Tsai-Raises-Red-Flags-Amid-Soaring-Investments-1705640,United States,English,econotimes.com
Will Nvidia Stock Skyrocket in 2025 ? Here What Jensen Huang Just Revealed ! ,2025-03-25 10:30:00+00:00,https://www.finsmes.com/2025/03/will-nvidia-stock-skyrocket-in-2025-heres-what-jensen-huang-just-revealed.html,United States,English,finsmes.com
"The Market Is Wrong : 3 Reasons Micron Stock Should Be Up , Not Down After Earnings",2025-03-25 11:30:00+00:00,https://www.fool.com/investing/2025/03/25/the-market-is-wrong-3-reasons-microns-stock-should/,United States,English,fool.com
NVIDIA Co . ( NASDAQ : NVDA ) Shares Bought by ICICI Prudential Asset Management Co Ltd,2025-03-25 12:00:00+00:00,https://www.defenseworld.net/2025/03/25/nvidia-co-nasdaqnvda-shares-bought-by-icici-prudential-asset-management-co-ltd.html,Russia,English,defenseworld.net
Baystreet . ca - China DeepSeek reveales updated AI model as OpenAI rivalry intensifies,2025-03-25 12:00:00+00:00,http://baystreet.ca/investing/109878/Chinas-DeepSeek-reveales-updated-AI-model-as-OpenAI-rivalry-intensifies--Reuters,Canada,English,baystreet.ca
Pasadena Private Wealth LLC Grows Stock Position in NVIDIA Co . ( NASDAQ : NVDA ) ,2025-03-25 12:00:00+00:00,https://www.defenseworld.net/2025/03/25/pasadena-private-wealth-llc-grows-stock-position-in-nvidia-co-nasdaqnvda.html,Russia,English,defenseworld.net
Private Wealth Partners LLC Reduces Stock Holdings in NVIDIA Co . ( NASDAQ : NVDA ) ,2025-03-25 12:00:00+00:00,https://www.defenseworld.net/2025/03/25/private-wealth-partners-llc-reduces-stock-holdings-in-nvidia-co-nasdaqnvda.html,Russia,English,defenseworld.net
NVIDIA Co . ( NASDAQ : NVDA ) Shares Sold by SNS Financial Group LLC,2025-03-25 12:00:00+00:00,https://www.defenseworld.net/2025/03/25/nvidia-co-nasdaqnvda-shares-sold-by-sns-financial-group-llc.html,Russia,English,defenseworld.net
"CogentBlue Wealth Advisors LLC Buys Shares of 12 , 359 NVIDIA Co . ( NASDAQ : NVDA ) ",2025-03-25 12:00:00+00:00,https://www.defenseworld.net/2025/03/25/cogentblue-wealth-advisors-llc-buys-shares-of-12359-nvidia-co-nasdaqnvda.html,Russia,English,defenseworld.net
NVIDIA Co . ( NASDAQ : NVDA ) Shares Bought by Strata Wealth Advisors LLC,2025-03-25 12:00:00+00:00,https://www.defenseworld.net/2025/03/25/nvidia-co-nasdaqnvda-shares-bought-by-strata-wealth-advisors-llc.html,Russia,English,defenseworld.net
"Sterling Financial Planning Inc . Invests $207 , 000 in NVIDIA Co . ( NASDAQ : NVDA ) ",2025-03-25 12:00:00+00:00,https://www.defenseworld.net/2025/03/25/sterling-financial-planning-inc-invests-207000-in-nvidia-co-nasdaqnvda.html,Russia,English,defenseworld.net
"Summit Place Financial Advisors LLC Sells 3 , 366 Shares of NVIDIA Co . ( NASDAQ : NVDA ) ",2025-03-25 12:00:00+00:00,https://www.defenseworld.net/2025/03/25/summit-place-financial-advisors-llc-sells-3366-shares-of-nvidia-co-nasdaqnvda.html,Russia,English,defenseworld.net
Cumberland Partners Ltd Raises Stock Holdings in NVIDIA Co . ( NASDAQ : NVDA ) ,2025-03-25 12:00:00+00:00,https://www.defenseworld.net/2025/03/25/cumberland-partners-ltd-raises-stock-holdings-in-nvidia-co-nasdaqnvda.html,Russia,English,defenseworld.net
"The Market Is Wrong : 3 Reasons Micron Stock Should Be Up , Not Down After Earnings",2025-03-25 12:45:00+00:00,https://www.fool.com/investing/2025/03/25/the-market-is-wrong-3-reasons-microns-stock-should/?source=iedfolrf0000001,United States,English,fool.com
"Four AI stocks to buy now and hold , says the manager of a five - star , $58B global fund",2025-03-25 13:15:00+00:00,https://www.morningstar.com/news/marketwatch/2025032536/four-ai-stocks-to-buy-now-and-hold-says-the-manager-of-a-five-star-58b-global-fund,China,English,morningstar.com
Semiconductor Stock Outlook : the AI Boom vs . a Slowing Economy,2025-03-25 13:15:00+00:00,https://www.morningstar.com/stocks/semiconductor-stock-outlook-ai-boom-vs-slowing-economy,China,English,morningstar.com
NVIDIA Corporation ( NVDA ): Powering the AI Revolution with Unmatched Growth Potential,2025-03-25 13:30:00+00:00,https://www.insidermonkey.com/blog/nvidia-corporation-nvda-powering-the-ai-revolution-with-unmatched-growth-potential-1490307/,United States,English,insidermonkey.com
How To Trade SPY : A Technical Perspective,2025-03-25 14:45:00+00:00,https://www.benzinga.com/trading-ideas/technicals/25/03/44472318/how-to-trade-spy-today-a-technical-perspective,United States,English,benzinga.com
Nvidia Sharp Decline - Financial News,2025-03-25 14:45:00+00:00,https://www.financial-news.co.uk/nvidias-sharp-decline/,United Kingdom,English,financial-news.co.uk
The 10 Most Valuable Car Companies,2025-03-25 15:15:00+00:00,https://wtop.com/news/2025/03/the-10-most-valuable-car-companies/,United States,English,wtop.com
Tech sector dominates : Meta and Apple lead today market surge,2025-03-25 15:15:00+00:00,https://www.forexlive.com/stock-market-update/tech-sector-dominates-meta-and-apple-lead-todays-market-surge-20250325/,Greece,English,forexlive.com
1 Trillion Reasons Why Nvidia Stock Is a Screaming Buy Now,2025-03-25 15:30:00+00:00,https://www.fool.com/investing/2025/03/25/1-trillion-reasons-why-nvidia-stock-is-a-screaming/,United States,English,fool.com
Cerebras IPO faces further delay due to US national security review : report ( CBRS : Pending ) ,2025-03-25 15:30:00+00:00,https://seekingalpha.com/news/4424813-cerebras-ipo-faces-further-delay-due-to-us-national-security-review-report,United States,English,seekingalpha.com
Market Analysis : NVIDIA And Competitors In Semiconductors & Semiconductor Equipment Industry,2025-03-25 15:30:00+00:00,https://biztoc.com/x/93724cbc4ff7dc84,,English,biztoc.com
Quantum and AI Disruption Is Creating a New Class of Must - Watch Tech Stocks,2025-03-25 15:45:00+00:00,https://www.marketscreener.com/quote/stock/SCOPE-TECHNOLOGIES-CORP-145512674/news/Quantum-and-AI-Disruption-Is-Creating-a-New-Class-of-Must-Watch-Tech-Stocks-49428336/,,English,marketscreener.com
Quantum and AI Disruption Is Creating a New Class of Must - Watch Tech Stocks,2025-03-25 15:45:00+00:00,https://www.prnewswire.com/news-releases/quantum-and-ai-disruption-is-creating-a-new-class-of-must-watch-tech-stocks-302410878.html,United States,English,prnewswire.com
"Loop Capital : Apple Is Placing ~$1 Billion Worth Of Orders For NVIDIA GB300NVL72 , With Super Micro Computer ( SMCI ) And Dell Tapped As  Key Server Partners  ",2025-03-25 17:00:00+00:00,https://wccftech.com/loop-capital-apple-is-placing-1-billion-worth-of-orders-for-nvidias-gb300nvl72-with-super-micro-computer-smci-and-dell-tapped-as-key-server-partners/,United States,English,wccftech.com
Nvidia latest innovation started as an April Fool joke 8 years ago,2025-03-25 17:00:00+00:00,https://qz.com/nvidias-latest-innovation-started-as-an-april-fools-jok-1851772221,United States,English,qz.com
NVIDIA Corporation ( NASDAQ : NVDA ): One of Philippe Laffont Stock Portfolio Top 10 Stock Picks,2025-03-25 17:30:00+00:00,https://www.insidermonkey.com/blog/nvidia-corporation-nasdaqnvda-one-of-philippe-laffont-stock-portfolios-top-10-stock-picks-1492477/,United States,English,insidermonkey.com
"Nvidia , Oracle , others asking Trump administration to relax AI chip rules",2025-03-25 17:45:00+00:00,https://qz.com/trump-administration-ai-diffusion-rules-chips-nvidia-1851772199,United States,English,qz.com
Top Automotive Stocks To Watch Now – March 25th,2025-03-25 19:45:00+00:00,https://www.tickerreport.com/banking-finance/12888984/top-automotive-stocks-to-watch-now-march-25th.html,United States,English,tickerreport.com
Promising Large Cap Stocks To Follow Today – March 25th,2025-03-25 20:45:00+00:00,https://theenterpriseleader.com/2025/03/25/promising-large-cap-stocks-to-follow-today-march-25th.html,United States,English,theenterpriseleader.com
"Want To Buy Stocks In 2025 ? There One Conflicting Place To Find Winners , Analyst Says - Franklin Resources ( NYSE : BEN ), Amazon . com ( NASDAQ : AMZN ) ",2025-03-25 21:30:00+00:00,https://www.benzinga.com/analyst-ratings/analyst-color/25/03/44483044/want-to-buy-stocks-in-2025-theres-one-conflicting-place-to-find-winners,United States,English,benzinga.com
It Been 25 Years Since the Dotcom Bubble Burst . Here Are the Stocks You Wish Youd Bought,2025-03-25 22:00:00+00:00,https://www.investopedia.com/it-s-been-25-years-since-the-dotcom-bubble-burst-here-are-the-stocks-you-wish-you-d-bought-11703278,United States,English,investopedia.com
Stocks lose steam as investors get anxious about economy,2025-03-25 22:00:00+00:00,https://qz.com/stocks-lose-steam-tesla-nvidia-boeing-xiaomi-trumpmedia-1851772279,United States,English,qz.com
"Nvidia Is A Good Buy In This Sideways Market - NVIDIA ( NASDAQ : NVDA ), Advanced Micro Devices ( NASDAQ : AMD ) ",2025-03-25 22:15:00+00:00,https://www.benzinga.com/tech/25/03/44483751/nvidia-is-a-good-buy-in-this-sideways-market,United States,English,benzinga.com
Direxion Daily NVDA Bull 2X Shares ( NASDAQ : NVDU ) Announces Quarterly Dividend of $0 . 42,2025-03-25 23:45:00+00:00,https://www.modernreaders.com/news/2025/03/25/direxion-daily-nvda-bull-2x-shares-nasdaqnvdu-announces-quarterly-dividend-of-0-42.html,United States,English,modernreaders.com
Direxion Daily NVDA Bull 2X Shares Declares Quarterly Dividend of $0 . 42 ( NASDAQ : NVDU ) ,2025-03-26 00:00:00+00:00,https://www.themarketsdaily.com/2025/03/25/direxion-daily-nvda-bull-2x-shares-declares-quarterly-dividend-of-0-42-nasdaqnvdu.html,United States,English,themarketsdaily.com
Direxion Daily NVDA Bear 1X Shares Announces Quarterly Dividend of $0 . 05 ( NASDAQ : NVDD ) ,2025-03-26 00:45:00+00:00,https://www.dailypolitical.com/2025/03/25/direxion-daily-nvda-bear-1x-shares-announces-quarterly-dividend-of-0-05-nasdaqnvdd.html,United States,English,dailypolitical.com
Direxion Daily NVDA Bear 1X Shares ( NASDAQ : NVDD ) to Issue Quarterly Dividend of $0 . 05,2025-03-26 01:30:00+00:00,https://www.tickerreport.com/banking-finance/12889074/direxion-daily-nvda-bear-1x-shares-nasdaqnvdd-to-issue-quarterly-dividend-of-0-05.html,United States,English,tickerreport.com
"Boeing upgraded , Lockheed downgraded : Wall Street top analyst calls",2025-03-26 01:30:00+00:00,https://finance.yahoo.com/news/boeing-upgraded-lockheed-downgraded-wall-133428391.html,United States,English,finance.yahoo.com
The  Magnificent Seven  Stocks Are Selling Off . Here Are My Top 5 to Buy Now . ,2025-03-26 02:15:00+00:00,https://www.fool.com/investing/2025/03/25/the-magnificent-seven-stocks-are-selling-off-here/?source=iedfolrf0000001,United States,English,fool.com
Did Amazon Just Say  Checkmate  to Nvidia ? ,2025-03-26 02:15:00+00:00,https://www.fool.com/investing/2025/03/25/did-amazon-just-say-checkmate-to-nvidia/?source=iedfolrf0000001,United States,English,fool.com
"Investors Are Gripped by Fear and Distrust , But Hold Onto Favorite Stocks",2025-03-26 02:45:00+00:00,https://www.investopedia.com/investors-are-gripped-by-fear-and-distrust-but-hold-onto-favorite-stocks-11703339,United States,English,investopedia.com
NVIDIA Corporation ( NVDA ) Showcases AI Future at GTC Conference With Game - Changing Chip and Robot Reveals,2025-03-26 03:30:00+00:00,https://www.insidermonkey.com/blog/nvidia-corporation-nvda-showcases-ai-future-at-gtc-conference-with-game-changing-chip-and-robot-reveals-1493032/,United States,English,insidermonkey.com
Stock market selloffs may have  washed out  some buyers : IBKR,2025-03-26 05:15:00+00:00,https://seekingalpha.com/news/4424982-stock-market-selloffs-may-have-washed-out-some-buyers-ibkr,United States,English,seekingalpha.com
Baystreet . ca - Why the Dow Jumped Nearly 600 Points,2025-03-26 05:15:00+00:00,http://baystreet.ca/articles/stockstowatch/109896/Why-the-Dow-Jumped-Nearly-600-Points,Canada,English,baystreet.ca
"US adds dozens of Chinese entities to export blacklist , including Inspur units",2025-03-26 06:45:00+00:00,https://www.stabroeknews.com/2025/03/26/news/world/us-adds-dozens-of-chinese-entities-to-export-blacklist-including-inspur-units/,Guyana,English,stabroeknews.com
Equities Analysts Issue Forecasts for NVIDIA FY2027 Earnings,2025-03-26 07:30:00+00:00,https://www.dailypolitical.com/2025/03/25/equities-analysts-issue-forecasts-for-nvidia-fy2027-earnings.html,United States,English,dailypolitical.com
Promising Large Cap Stocks To Follow Now – March 24th,2025-03-26 08:30:00+00:00,https://www.wkrb13.com/2025/03/26/promising-large-cap-stocks-to-follow-now-march-24th.html,United States,English,wkrb13.com
Aspect Partners LLC Increases Stake in NVIDIA Co . ( NASDAQ : NVDA ) ,2025-03-26 09:15:00+00:00,https://www.etfdailynews.com/2025/03/26/aspect-partners-llc-increases-stake-in-nvidia-co-nasdaqnvda/,United States,English,etfdailynews.com
Dow jumps 598 points as Trump eases off on tariff plans,2025-03-26 09:15:00+00:00,https://finance.yahoo.com/news/dow-jumps-598-points-trump-210000995.html,United States,English,finance.yahoo.com
"Wealth Alliance Sells 1 , 895 Shares of NVIDIA Co . ( NASDAQ : NVDA ) ",2025-03-26 09:15:00+00:00,https://www.etfdailynews.com/2025/03/26/wealth-alliance-sells-1895-shares-of-nvidia-co-nasdaqnvda/,United States,English,etfdailynews.com
Elk River Wealth Management LLC Has $6 . 76 Million Holdings in NVIDIA Co . ( NASDAQ : NVDA ) ,2025-03-26 09:15:00+00:00,https://www.etfdailynews.com/2025/03/26/elk-river-wealth-management-llc-has-6-76-million-holdings-in-nvidia-co-nasdaqnvda/,United States,English,etfdailynews.com
First National Bank & Trust Co . of Newtown Has $6 . 96 Million Stock Holdings in NVIDIA Co . ( NASDAQ : NVDA ) ,2025-03-26 09:15:00+00:00,https://www.etfdailynews.com/2025/03/26/first-national-bank-trust-co-of-newtown-has-6-96-million-stock-holdings-in-nvidia-co-nasdaqnvda/,United States,English,etfdailynews.com
"O Brien Greene & Co . Inc Purchases 1 , 291 Shares of NVIDIA Co . ( NASDAQ : NVDA ) ",2025-03-26 09:15:00+00:00,https://www.etfdailynews.com/2025/03/26/o-brien-greene-co-inc-purchases-1291-shares-of-nvidia-co-nasdaqnvda/,United States,English,etfdailynews.com
Advyzon Investment Management LLC Invests $2 . 82 Million in NVIDIA Co . ( NASDAQ : NVDA ) ,2025-03-26 09:15:00+00:00,https://www.etfdailynews.com/2025/03/26/advyzon-investment-management-llc-invests-2-82-million-in-nvidia-co-nasdaqnvda/,United States,English,etfdailynews.com
"China Huawei Reportedly Doubles AI Chip Yields To 40 % Now , Nvidia CEO Jensen Huang Warns That The Chinese Tech Giant Is The  Most Formidable  Competitor Despite US Sanctions",2025-03-26 10:15:00+00:00,https://biztoc.com/x/6adeaca1bbdf1ed2,,English,biztoc.com
"Amazon AI Cloud Strategy To Stay Strong Despite  Near - Term Turbulence , Says Analyst",2025-03-26 10:15:00+00:00,https://biztoc.com/x/ccc2cce71864764c,,English,biztoc.com
"Morgan Stanley is getting more bullish on China stocks . But there a key risk , and it not just tariffs . ",2025-03-26 11:15:00+00:00,https://www.morningstar.com/news/marketwatch/2025032628/morgan-stanley-is-getting-more-bullish-on-china-stocks-but-theres-a-key-risk-and-its-not-just-tariffs,China,English,morningstar.com
Stock Market Uncertainty Has Rattled Investors . Is Artificial Intelligence ( AI ) Darling Nvidia Still a Buy ? ,2025-03-26 11:45:00+00:00,https://finance.yahoo.com/news/stock-market-uncertainty-rattled-investors-111500863.html,United States,English,finance.yahoo.com
3 Must - See Updates From Nvidia AI Event,2025-03-26 13:30:00+00:00,https://finance.yahoo.com/news/3-must-see-updates-nvidias-125300301.html,United States,English,finance.yahoo.com
Is Quantum Computing Pioneer IonQ the Next Nvidia ? ,2025-03-26 13:30:00+00:00,https://finance.yahoo.com/news/quantum-computing-pioneer-ionq-next-130000750.html,United States,English,finance.yahoo.com
Nvidia Faces New Hurdles in China as Energy Rules Threaten AI Chip Sales,2025-03-26 13:45:00+00:00,http://www.econotimes.com/Nvidia-Faces-New-Hurdles-in-China-as-Energy-Rules-Threaten-AI-Chip-Sales-1705758,United States,English,econotimes.com
"In Geopolitical Chess , China Latest Energy Norms Block Nvidia Chip Strategy Amid US Sanctions - NVIDIA ( NASDAQ : NVDA ) ",2025-03-26 14:00:00+00:00,https://www.benzinga.com/25/03/44493961/nvidia-faces-17-billion-threat-in-china-as-chip-rules-tighten-and-huawei-gains-ground,United States,English,benzinga.com
Every Nvidia Investor Should Keep an Eye on This Number,2025-03-26 14:30:00+00:00,https://www.fool.com/investing/2025/03/26/every-nvidia-investor-should-keep-an-eye-on-this/?source=iedfolrf0000001,United States,English,fool.com
3 Must - See Updates From Nvidia AI Event,2025-03-26 14:30:00+00:00,https://www.fool.com/investing/2025/03/26/3-must-see-updates-from-nvidias-ai-event/?source=iedfolrf0000001,United States,English,fool.com
"US Adds 50 Chinese Entities To Export Restriction List Curtailing Access To Nvidia , AMD Chips - NVIDIA ( NASDAQ : NVDA ) ",2025-03-26 14:45:00+00:00,https://www.benzinga.com/news/global/25/03/44494896/us-adds-50-chinese-entities-to-export-restriction-list-curtailing-access-to-nvidia-amd-chips,United States,English,benzinga.com
Top Large Cap Stocks To Keep An Eye On – March 23rd,2025-03-26 14:45:00+00:00,https://www.wkrb13.com/2025/03/26/top-large-cap-stocks-to-keep-an-eye-on-march-23rd.html,United States,English,wkrb13.com
Tech Sector Weakness Weighing On Wall Street,2025-03-26 15:30:00+00:00,https://www.rttnews.com/story.aspx?Id=3524492,United States,English,rttnews.com
My Top 3 Bargain AI Stocks to Buy after the Stock Market Drop,2025-03-26 16:30:00+00:00,https://www.fool.com/investing/2025/03/26/my-top-3-bargain-ai-stocks-to-buy-in-the-stock/?source=iedfolrf0000001,United States,English,fool.com
"Top Stock Movers Now : Nvidia , Vertiv , Dollar Tree , and More",2025-03-26 16:30:00+00:00,https://finance.yahoo.com/news/top-stock-movers-now-nvidia-155508336.html,United States,English,finance.yahoo.com
Why Nvidia Stock Is Sinking Today,2025-03-26 16:45:00+00:00,https://finance.yahoo.com/news/why-nvidia-stock-sinking-today-161340578.html,United States,English,finance.yahoo.com
"Cramer plan for Alphabet stock , why Nvidia sell - off is misguided",2025-03-26 17:00:00+00:00,https://www.cnbc.com/2025/03/26/cramers-plan-for-alphabet-stock-why-nvidias-sell-off-is-misguided.html,United States,English,cnbc.com
Tech Sector Weakness Weighing On Wall Street,2025-03-26 17:00:00+00:00,https://www.rttnews.com/3524492/tech-sector-weakness-weighing-on-wall-street.aspx,United States,English,rttnews.com
"Copper Hits A New High , Consumer Confidence At Four - Year Low , Market Mechanics Control Stock Market - United States Copper Index Fund ETV ( ARCA : CPER ), First Quantum Minerals ( OTC : FQVLF ) ",2025-03-26 17:15:00+00:00,https://www.benzinga.com/markets/equities/25/03/44498527/copper-hits-a-new-high-consumer-confidence-at-four-year-low-market-mechanics-control-stock-marke,United States,English,benzinga.com
"US imposes export restrictions on 70 companies , including Pakistani firms",2025-03-26 18:15:00+00:00,https://thefrontierpost.com/us-imposes-export-restrictions-on-70-companies-including-pakistani-firms/,Pakistan,English,thefrontierpost.com
